CleanRef,CitationCount,UniqueYears,SourceType,Categories,BlueprintCategories,Tier
"Gaitonde DY, Moore FC, Morgan MK: Influenza: Diagnosis and treatment. Am Fam Physician 2019;100(12):751-758.",5,3,AFP,Respiratory,,Must-Read
"Gentry S, Gentry B: Chronic obstructive pulmonary disease: Diagnosis and management. Am Fam Physician 2017;95(7):433-441.",5,3,AFP,Respiratory,,Must-Read
"Higdon ML, Atkinson CJ, Lawrence KV: Oncologic emergencies: Recognition and initial management. Am Fam Physician 2018;97(11):741-748.",6,3,AFP,"Cardiovascular, Endocrine, Hematologic/Immune",,Must-Read
"Langan RC, Goodbred AJ: Office spirometry: Indications and interpretation. Am Fam Physician 2020;101(6):362-368.",4,3,AFP,Respiratory,,Must-Read
"Smith DK, Lennon RP, Carlsgaard PB: Managing hypertension using combination therapy. Am Fam Physician 2020;101(6):341-349.",5,3,AFP,"Cardiovascular, Endocrine, Nephrologic",,Must-Read
"Smith DK, McDermott AJ, Sullivan JF: Croup: Diagnosis and management. Am Fam Physician 2018;97(9):575-580.",4,3,AFP,Respiratory,,Must-Read
"Barstow C, Shahan B, Roberts M: Evaluating medical decision-making capacity in practice. Am Fam Physician 2018;98(1):40-46.",4,3,AFP,Patient-Based Systems,,Must-Read
"Trayes KP, Savage K, Studdiford JS: Annular lesions: Diagnosis and treatment. Am Fam Physician 2018;98(5):283-291.",4,1,AFP,"Integumentary, Respiratory",,Core
"Kant R, Davis A, Verma V: Thyroid nodules: Advances in evaluation and management. Am Fam Physician 2020;102(5):298-304.",4,3,AFP,Endocrine,,Must-Read
Kale N: Urine drug tests: Ordering and interpreting results. Am Fam Physician 2019;99(1):33-39.,3,2,AFP,"Population-Based Care, Psychogenic",,Core
"Charles L, Triscott J, Dobbs B. Secondary hypertension: discovering the underlying cause. Am Fam Physician. 2017;96(7):453-461.",6,2,AFP,"Cardiovascular, Endocrine, Nephrologic",,Core
"Hitzeman N, Cotton E: Incidentalomas: Initial management. Am Fam Physician 2014;90(11):784-789.",3,3,AFP,"Endocrine, Reproductive:Female",,Must-Read
"ElSayed NA, Aleppo G, Aroda VR, et al. 9. Pharmacologic approaches to glycemic treatment: standards of care in diabetes—2023. Diabetes Care. 2023;46(Suppl 1):S140-S157.",3,1,Endocrine Journal,"Endocrine, Nephrologic",,Core
Ramirez J: Adhesive capsulitis: Diagnosis and management. Am Fam Physician 2019;99(5):297-300.,3,3,AFP,"Cardiovascular, Musculoskeletal",,Must-Read
"Saguil A, Kane SF, Lauters R, Mercado MG: Hand-foot-and-mouth disease: Rapid evidence review. Am Fam Physician 2019;100(7):408-414.",4,3,AFP,"Integumentary, Special Sensory",,Must-Read
Saguil A: Psychological and pharmacologic treatments for adults with PTSD. Am Fam Physician 2019;99(9):577-583.,3,3,AFP,Psychogenic,,Must-Read
"Silver S, Ledford CC, Vogel KJ, Arnold JJ: Peripheral nerve entrapment and injury in the upper extremity. Am Fam Physician 2021;103(5):275-285.",3,3,AFP,Neurologic,,Must-Read
"Smith DK, Seales S, Budzik C: Respiratory syncytial virus bronchiolitis in children. Am Fam Physician 2017;95(2):94-99.",3,3,AFP,Respiratory,,Must-Read
"Steinberg J, Carlson L: Type 2 diabetes therapies: A STEPS approach. Am Fam Physician 2019;99(4):237-243.",3,2,AFP,Endocrine,,Core
"Stephens MB, Wiedemer JP, Kushner GM: Dental problems in primary care. Am Fam Physician 2018;98(11):654-660.",3,2,AFP,"Neurologic, Population-Based Care, Special Sensory",,Core
"Sur DKC, Plesa ML. Antibiotic use in acute upper respiratory tract infections. Am Fam Physician. 2022;106(6):628-636.",3,1,AFP,Respiratory,,Core
"Wilkins T, Embry K, George R: Diagnosis and management of acute diverticulitis. Am Fam Physician 2013;87(9):612-620.",3,3,AFP,"Gastrointestinal, Population-Based Care",,Must-Read
"Fontenelle LF, Sarti TD. Kidney stones: treatment and prevention. Am Fam Physician. 2019;99(8):490-496.",4,2,AFP,Nephrologic,,Core
"Gaitonde DY, Cook DL, Rivera IM: Chronic kidney disease: Detection and evaluation. Am Fam Physician 2017;96(12):776-783.",2,1,AFP,"Endocrine, Nephrologic",,Core
"Becker BA, Childress MA: Common foot problems: Over-the-counter treatments and home care. Am Fam Physician 2018;98(5):298-303.",2,1,AFP,"Integumentary, Musculoskeletal",,Core
"Herrick KR, Trondle ME, Febles TT: Coccidioidomycosis (valley fever) in primary care. Am Fam Physician 2020;101(4):221-228.",2,2,AFP,"Hematologic/Immune, Respiratory",,Core
"Global Initiative for Chronic Obstructive Lung Disease. 2023 Report: global strategy for the diagnosis, management, and prevention of chronic obstructive pulmonary disease. Updated 2023.",2,1,Guideline/Org,Respiratory,,Core
"DeGeorge KC, Ring DJ, Dalrymple SN: Treatment of the common cold. Am Fam Physician 2019;100(5):281-289.",2,2,AFP,Respiratory,,Core
"Galima SV, Vogel SR, Kowalski AW: Seasonal affective disorder: Common questions and answers. Am Fam Physician 2020;102(11):668-672.",2,2,AFP,Psychogenic,,Core
"Final Recommendation Statement: Falls Prevention in Community-Dwelling Older Adults: Interventions. US Preventive Services Task Force, 2018.",2,1,Guideline/Org,Population-Based Care,,Core
"Hartman S, Brown E, Loomis E, Russell HA: Gastroenteritis in children. Am Fam Physician 2019;99(3):159-165.",2,2,AFP,Gastrointestinal,,Core
"Arnold MJ, Moody AL: Common running injuries: Evaluation and management. Am Fam Physician 2018;97(8):510-516.",2,2,AFP,Musculoskeletal,,Core
"Zolotor AJ, Carlough MC: Update on prenatal care. Am Fam Physician 2014;89(3):199-208.",2,2,AFP,Reproductive:Female,,Core
"Hu JS, Pierre EF: Urinary incontinence in women: Evaluation and management. Am Fam Physician 2019;100(6):339-348.",2,2,AFP,Nephrologic,,Core
"Gauer R, Forbes D, Boyer N: Sepsis: Diagnosis and management. Am Fam Physician 2020;101(7):409-418.",2,2,AFP,"Cardiovascular, Respiratory",,Core
"Gauer R, Meyers BK: Heat-related illnesses. Am Fam Physician 2019;99(8):482-489.",2,2,AFP,"Musculoskeletal, Population-Based Care",,Core
"Frazier W, Bhardwaj N: Atopic dermatitis: Diagnosis and treatment. Am Fam Physician 2020;101(10):590-598.",2,1,AFP,Integumentary,,Core
"Carlisle RT, Digiovanni J: Differential diagnosis of the swollen red eyelid. Am Fam Physician 2015;92(2):106-112.",2,2,AFP,Integumentary,,Core
"Klein DA, Paradise SL, Goodwin ET: Caring for transgender and gender-diverse persons: What clinicians should know. Am Fam Physician 2018;98(11):645-653.",3,2,AFP,"Patient-Based Systems, Reproductive:Female, Respiratory",,Core
"Bachmann LM, Haberzeth S, Steurer J, ter Riet G: The accuracy of the Ottawa knee rule to rule out knee fractures: A systematic review. Ann Intern Med 2004;140(2):121-124.",2,2,Annals,Musculoskeletal,,Core
"Carpenter M, Berry H, Pelletier AL: Clinically relevant drug-drug interactions in primary care. Am Fam Physician 2019;99(9):558-564.",2,2,AFP,"Hematologic/Immune, Psychogenic",,Core
"Gregory DS, Wu V, Tuladhar P: The pregnant patient: Managing common acute medical problems. Am Fam Physician 2018;98(9):595-602.",2,2,AFP,"Gastrointestinal, Reproductive:Female",,Core
"Falk N, Cole A, Meredith TJ: Evaluation of suspected dementia. Am Fam Physician 2018;97(6):398-405.",3,2,AFP,"Population-Based Care, Psychogenic",,Core
"Hembree WC, Cohen-Kettenis PT, Gooren L, et al: Endocrine treatment of gender-dysphoric/gender-incongruent persons: An Endocrine Society clinical practice guideline. J Clin Endocrinol Metab 2017;102(11):3869-3903.",2,2,Guideline/Org,Reproductive:Female,,Must-Read
"Juckett G, Unger K: Appropriate use of medical interpreters. Am Fam Physician 2014;90(7):476-480.",2,2,AFP,"Cardiovascular, Respiratory",,Core
Chamberlain R: Hip pain in adults: Evaluation and differential diagnosis. Am Fam Physician 2021;103(2):81-89.,3,2,AFP,Musculoskeletal,,Core
"Budhwar N, Syed Z: Chronic dyspnea: Diagnosis and evaluation. Am Fam Physician 2020;101(9):542-548.",2,2,AFP,Respiratory,,Core
"Klein DA, Paradise SL, Reeder RM: Amenorrhea: A systematic approach to diagnosis and management. Am Fam Physician 2019;100(1):39-48.",3,2,AFP,Reproductive:Female,,Core
"Labaki WW, Rosenberg SR: Chronic obstructive pulmonary disease. Ann Intern Med 2020;173(3):ITC17-ITC32.",2,1,Annals,Respiratory,,Core
"Lam NC, Ghetu MV, Bieniek ML: Systemic lupus erythematosus: Primary care approach to diagnosis and management. Am Fam Physician 2016;94(4):284-294.",3,2,AFP,"Hematologic/Immune, Musculoskeletal, Respiratory",,Core
American Diabetes Association Professional Practice Committee: 9. Pharmacologic approaches to glycemic treatment: Standards of Medical Care in Diabetes—2022. Diabetes Care 2022;45(Suppl 1):S125-S143.,2,1,Guideline/Org,Endocrine,,Core
"Lewis WD, Lilly S, Jones KL: Lymphoma: Diagnosis and treatment. Am Fam Physician 2020;101(1):34-41.",2,2,AFP,"Endocrine, Hematologic/Immune",,Core
Lillig M: Conduct disorder: Recognition and management. Am Fam Physician 2018;98(10):584-592.,2,2,AFP,Psychogenic,,Core
"Mandell LA, Niederman MS: Aspiration pneumonia. N Engl J Med 2019;380(7):651-663.",2,2,NEJM,"Gastrointestinal, Respiratory",,Core
"Matheson E, Bain J: Hirsutism in women. Am Fam Physician 2019;100(3):168-175.",2,2,AFP,Endocrine,,Core
"Mayans L, Walling A: Acute migraine headache: Treatment strategies. Am Fam Physician 2018;97(4):243-251.",2,2,AFP,"Neurologic, Reproductive:Female",,Core
"McGrath K, Edi R: Diabetic kidney disease: Diagnosis, treatment, and prevention. Am Fam Physician 2019;99(12):751-759.",2,2,AFP,"Endocrine, Nephrologic",,Core
"Metlay JP, Waterer GW, Long AC, et al. Diagnosis and treatment of adults with community-acquired pneumonia. An official clinical practice guideline of the American Thoracic Society and Infectious Diseases Society of America. Am J Respir Crit Care Med. 2019;200(7):e45-e67.",4,1,Guideline/Org,"Cardiovascular, Respiratory",,Core
"Michaudet C, Malaty J: Chronic cough: Evaluation and management. Am Fam Physician 2017;96(9):575–580.",3,2,AFP,"Cardiovascular, Respiratory",,Core
"Michels A, Michels N: Addison disease: Early detection and treatment principles. Am Fam Physician 2014;89(7):563-568.",2,2,AFP,"Endocrine, Integumentary",,Core
"Naranje S, Kelly DM, Sawyer JR: A systematic approach to the evaluation of a limping child. Am Fam Physician 2015;92(10):908-916.",2,2,AFP,Musculoskeletal,,Core
"Oh RC, Trivette ET, Westerfield KL: Management of hypertriglyceridemia: Common questions and answers. Am Fam Physician 2020;102(6):347-354.",2,2,AFP,Cardiovascular,,Core
"Patel DS, Statuta SM, Ahmed N: Common fractures of the radius and ulna. Am Fam Physician 2021;103(6):345-354.",2,2,AFP,Musculoskeletal,,Core
Peixoto AJ: Acute severe hypertension. N Engl J Med 2019;381(19):1843-1852.,2,2,NEJM,Cardiovascular,,Core
"Pelletier AL, Rojas-Roldan L, Coffin J: Vision loss in older adults. Am Fam Physician 2016;94(3):219-226.",2,2,AFP,"Cardiovascular, Special Sensory",,Core
"Petering RC, Brooks NA: Testosterone therapy: Review of clinical applications. Am Fam Physician 2017;96(7):441-449.",2,2,AFP,"Cardiovascular, Endocrine",,Core
"Braun MM, Stevens WA, Barstow CH: Stable coronary artery disease: Treatment. Am Fam Physician 2018;97(6):376-384.",3,1,AFP,Cardiovascular,,Core
"Reamy BV, Williams PM, Odom MR: Pleuritic chest pain: Sorting through the differential diagnosis. Am Fam Physician 2017;96(5):306-312.",2,1,AFP,"Cardiovascular, Respiratory",,Core
"Rerucha CM, Ewing JT, Oppenlander KE, Cowan WC: Acute hand infections. Am Fam Physician 2019;99(4):228-236.",2,1,AFP,Musculoskeletal,,Core
"Runser LA, Gauer RL, Houser A: Syncope: Evaluation and differential diagnosis. Am Fam Physician 2017;95(5):303-312.",2,1,AFP,Cardiovascular,,Core
"Rupert J, Honeycutt JD, Odom MR: Foreign bodies in the skin: Evaluation and management. Am Fam Physician 2020;101(12):740-747.",2,2,AFP,"Integumentary, Musculoskeletal",,Core
"Donangelo I, Suh SY: Subclinical hyperthyroidism: When to consider treatment. Am Fam Physician 2017;95(11):710-716.",2,2,AFP,Endocrine,,Core
"Brieler J, Breeden MA, Tucker J: Cardiomyopathy: An overview. Am Fam Physician 2017;96(10):640-646.",2,2,AFP,Cardiovascular,,Core
Salisbury-Afshar E: Adverse events of pharmacologic treatments of major depression in older adults. Am Fam Physician 2020;101(3):179-181.,2,2,AFP,Psychogenic,,Core
"Schroeder R, Harrison TD, McGraw SL: Treatment of adult obesity with bariatric surgery. Am Fam Physician 2016;93(1):31-37.",2,2,AFP,"Gastrointestinal, Hematologic/Immune",,Core
"Sell J, Ramirez S, Partin M. Parathyroid disorders. Am Fam Physician. 2022;105(3):289-298.",2,1,AFP,"Endocrine, Nephrologic",,Core
"Shehab R, Mirabelli MH: Evaluation and diagnosis of wrist pain: A case-based approach. Am Fam Physician 2013;87(8):568-573.",2,2,AFP,Musculoskeletal,,Core
"Hagan JF Jr, Shaw JS, Duncan PM (eds): Bright Futures: Guidelines for Health Supervision of Infants, Children and Adolescents, ed 4. American Academy of Pediatrics, 2017.",2,2,Guideline/Org,"Population-Based Care, Psychogenic",,Must-Read
"Hauk L: Tuberculosis: Guidelines for diagnosis from the ATS, IDSA, and CDC. Am Fam Physician 2018;97(1):56-58.",2,2,Guideline/Org,Population-Based Care,,Must-Read
"Chavey WE, Hogikyan RV, Van Harrison R, Nicklas JM: Heart failure due to reduced ejection fraction: Medical management. Am Fam Physician 2017;95(1):13-20.",2,2,AFP,Cardiovascular,,Core
"Kaysin A, Viera AJ: Community-acquired pneumonia in adults: Diagnosis and management. Am Fam Physician 2016;94(9):698-706.",2,2,AFP,"Gastrointestinal, Respiratory",,Core
"Stacey SK, McEleney M. Topical corticosteroids: choice and application. Am Fam Physician. 2021;103(6):337-343.",2,1,AFP,Integumentary,,Core
"Final Recommendation Statement: Abdominal Aortic Aneurysm: Screening. US Preventive Services Task Force, 2019.",7,2,Guideline/Org,"Cardiovascular, Gastrointestinal, Population-Based Care, Respiratory",,Must-Read
"Flynn JT, Kaelber DC, Baker-Smith CM, et al: Clinical practice guideline for screening and management of high blood pressure in children and adolescents. Pediatrics 2017;140(3):e20171904.",4,1,Guideline/Org,"Cardiovascular, Nephrologic, Population-Based Care",,Core
"Chow AW, Benninger MS, Brook I, et al: IDSA clinical practice guideline for acute bacterial rhinosinusitis in children and adults. Clin Infect Dis 2012;54(8):e72-e112.",3,2,Guideline/Org,Respiratory,,Must-Read
"Klein DA, Emerick JE, Sylvester JE, Vogt KS: Disorders of puberty: An approach to diagnosis and management. Am Fam Physician 2017;96(9):590-599.",2,1,AFP,Population-Based Care,,Core
"Trojian T, Tucker AK: Plantar fasciitis. Am Fam Physician 2019;99(12):744-750.",3,2,AFP,Musculoskeletal,,Core
Tu P. Heel pain: diagnosis and management. Am Fam Physician. 2018;97(2):86-93.,3,1,AFP,Musculoskeletal,,Core
"Final Recommendation Statement: Testicular Cancer: Screening. US Preventive Services Task Force, 2011.",4,1,Guideline/Org,"Gastrointestinal, Population-Based Care, Reproductive:Male, Respiratory",,Core
"Final Recommendation Statement: Vitamin D Deficiency In Adults: Screening. US Preventive Services Task Force, 2021.",2,1,Guideline/Org,"Endocrine, Population-Based Care",,Core
US Preventive Services Task Force. Recommendation topics. Updated 2023.,2,1,Guideline/Org,"Cardiovascular, Population-Based Care",,Core
"Viera AJ, Wouk N: Potassium disorders: Hypokalemia and hyperkalemia. Am Fam Physician 2015;92(6):487-495.",2,2,AFP,"Cardiovascular, Nephrologic",,Core
Wasserman A: Rheumatoid arthritis: Common questions about diagnosis and management. Am Fam Physician 2018;97(7):455-462.,2,2,AFP,"Hematologic/Immune, Musculoskeletal",,Core
"Achar S, Yamanaka J: Apophysitis and osteochondrosis: Common causes of pain in growing bones. Am Fam Physician 2019;99(10):610-618.",3,2,AFP,Musculoskeletal,,Core
Albert RH: End-of-life care: Managing common symptoms. Am Fam Physician 2017;95(6):356-361.,3,1,AFP,"Gastrointestinal, Patient-Based Systems, Respiratory",,Core
"Allison R 2nd, Assadzandi S, Adelman M: Frailty: Evaluation and management. Am Fam Physician 2021;103(4):219-226.",2,2,AFP,"Cardiovascular, Musculoskeletal",,Core
"Ables AZ, Nagubilli R: Prevention, recognition, and management of serotonin syndrome. Am Fam Physician 2010;81(9):1139-1142.",2,2,AFP,"Hematologic/Immune, Musculoskeletal",,Core
"Bunt CW, Jonas CE, Chang JG: Knee pain in adults and adolescents: The initial evaluation. Am Fam Physician 2018;98(9):576-585.",3,2,AFP,Musculoskeletal,,Core
"Wipperman J, Bragg DA, Litzner B: Hidradenitis suppurativa: Rapid evidence review. Am Fam Physician 2019;100(9):562-569.",2,2,AFP,Integumentary,,Core
American Diabetes Association. 3. Prevention or delay of type 2 diabetes: standards of medical care in diabetes—2021. Diabetes Care. 2021;44(Suppl 1):S34-S39.,2,1,Guideline/Org,"Endocrine, Population-Based Care",,Core
American Diabetes Association: 14. Management of diabetes in pregnancy: Standards of Medical Care in Diabetes—2020. Diabetes Care 2020;43(Suppl 1):S183-S192.,2,1,Guideline/Org,"Endocrine, Reproductive:Female",,Core
American Diabetes Association: 15. Diabetes care in the hospital: Standards of Medical Care in Diabetes–2020. Diabetes Care 2020;43(Suppl 1):S193-S202.,1,1,Guideline/Org,Endocrine,,Core
American Diabetes Association: 6. Glycemic targets: Standards of Medical Care in Diabetes—2021. Diabetes Care 2021;44(Suppl 1):S73-S84.,1,1,Guideline/Org,Endocrine,,Core
American Diabetes Association: Standards of Medical Care in Diabetes-2021 Abridged for primary care providers. Clin Diabetes 2021;39(1):14-43.,1,1,Guideline/Org,Nephrologic,,Core
"American Family Physician: EBM glossary. American Academy of Family Physicians, 2021.",1,1,Guideline/Org,Population-Based Care,,Core
American Geriatrics Society. Tip sheet: ten things clinicians and patients should question. ABIM Foundation Choosing Wisely campaign. Updated June,1,1,Other Journal,Patient-Based Systems,,Supplementary
"American Geriatrics Society: Avoid using prescription appetite stimulants or high-calorie supplements for treating of anorexia or cachexia in older adults; instead, optimize social supports, discontinue medications that may interfere with eating, provide appealing food and feeding assistance, and clarify patient goals and expectations. ABIM Foundation Choosing Wisely campaign, revised 2015.",1,1,Other Journal,Hematologic/Immune,,Supplementary
American Psychiatric Association: Practice guideline for the treatment of patients with bipolar disorder (revision). Am J Psychiatry 2002;159(4 Suppl):1-50.,1,1,Guideline/Org,Psychogenic,,Core
"American Psychiatric Association: The American Psychiatric Association Practice Guideline for the Pharmacological Treatment of Patients with Alcohol Use Disorder: Guideline Statement Summary. American Psychiatric Association Publishing, 2018.",1,1,Guideline/Org,Gastrointestinal,,Core
"American Society of Health-System Pharmacists: Five things physicians and patients should question. ABIM Foundation Choosing Wisely campaign, 2017.",1,1,Guideline/Org,Population-Based Care,,Core
"American Urological Association: Offer PSA screening for detecting prostate cancer only after engaging in shared decision making. ABIM Foundation Choosing Wisely campaign, 2015.",1,1,Other Journal,Patient-Based Systems,,Supplementary
"Ammendolia C, Stuber KJ, Rok E, et al: Nonoperative treatment for lumbar spinal stenosis with neurogenic claudication. Cochrane Database Syst Rev 2013;(8):CD010712.",1,1,Other Journal,Musculoskeletal,,Supplementary
"Anderson JL, Morrow DA: Acute myocardial infarction. N Engl J Med 2017;376(21):2053-2064.",1,1,NEJM,Cardiovascular,,Core
"Andrade-Castellanos CA, Colunga-Lozano LE, Delgado-Figueroa N, Magee K. Heparin versus placebo for non-ST elevation acute coronary syndromes. Cochrane Database Syst Rev. 2014;(6):CD003462.",1,1,Other Journal,Cardiovascular,,Supplementary
"Anker SD, Butler J, Filippatos G, et al. Empagliflozin in heart failure with a preserved ejection fraction. N Engl J Med. 2021;385(16):1451-1461.",1,1,NEJM,Cardiovascular,,Core
"Antibiotic prescribing and use: Adult outpatient treatment recommendations. Centers for Disease Control and Prevention, 2017.",1,1,Guideline/Org,Respiratory,,Core
"Armstrong AD, Hubbard MC (eds): Essentials of Musculoskeletal Care, ed 5. American Academy of Orthopaedic Surgeons, 2015, pp 510-516.",1,1,Guideline/Org,Musculoskeletal,,Core
"Armstrong AD, Hubbard MC, eds. Essentials of Musculoskeletal Care. 5th ed. American Academy of Orthopaedic Surgeons; 2018:739-745.",1,1,Guideline/Org,Musculoskeletal,,Core
Armstrong C: Influenza vaccination: Updated recommendations from ACIP. Am Fam Physician 2019;100(8):505-507.,1,1,Guideline/Org,Respiratory,,Core
Armstrong C: Lung cancer screening recommendations from the ACCP. Am Fam Physician 2018;98(11):688-689.,1,1,AFP,Population-Based Care,,Supplementary
"Arnett DK, Blumenthal RS, Albert MA, et al: 2019 ACC/AHA guideline on the primary prevention of cardiovascular disease: A report of the American College of Cardiology/American Heart Association Task Force on Clinical Practice Guidelines. Circulation 2019;140(11):e596-e646.",1,1,Guideline/Org,Cardiovascular,,Core
"Arnold JJ, Hehn LE, Klein DA: Common questions about recurrent urinary tract infections in women. Am Fam Physician 2016;93(7):560-569.",1,1,AFP,Reproductive:Female,,Supplementary
Arnold MJ: Venous thromboembolism: Management guidelines from the American Society of Hematology. Am Fam Physician 2021;104(4):429-431.,1,1,Guideline/Org,Cardiovascular,,Core
Aspirin use to prevent preeclampsia and related morbidity and mortality. Am Fam Physician 2022;105(4):online.,1,1,AFP,Hematologic/Immune,,Supplementary
"Atkinson B, Holland W, Stigleman S, et al: Platelet-rich plasma vs. corticosteroids for refractory plantar fasciitis. Am Fam Physician 2021;103(5):307-308.",1,1,AFP,Musculoskeletal,,Supplementary
"Attention deficit hyperactivity disorder: Diagnosis and management. National Institute for Health and Care Excellence (NICE), updated 2019.",1,1,Other Journal,Psychogenic,,Supplementary
"Authors/Task Force members, Elliott PM, Anastasakis A, et al. 2014 ESC guidelines on diagnosis and management of hypertrophic cardiomyopathy: the task force for the diagnosis and management of hypertrophic cardiomyopathy of the European Society of Cardiology (ESC). Eur Heart J. 2014;35(39):2733-2779.",1,1,Guideline/Org,Cardiovascular,,Core
"Autism spectrum disorder (ASD): signs and symptoms. Centers for Disease Control and Prevention. Reviewed March 28, 2022.",1,1,Guideline/Org,Psychogenic,,Core
"Bacelieri R, Johnson SM: Cutaneous warts: An evidence-based approach to therapy. Am Fam Physician 2005;72(4):647-652.",1,1,AFP,Integumentary,,Supplementary
"Bachmann LM, Kolb E, Koller MT, et al: Accuracy of Ottawa ankle rules to exclude fractures of the ankle and mid-foot: Systematic review. BMJ 2003;326(7386):417-423.",1,1,BMJ,Musculoskeletal,,Supplementary
"Bachoura A, Ferikes AJ, Lubahn JD. A review of mallet finger and jersey finger injuries in the athlete. Curr Rev Musculoskelet Med. 2017;10(1):1-9.",1,1,Other Journal,Musculoskeletal,,Supplementary
"Bahar-Fuchs A, Clare L, Woods B: Cognitive training and cognitive rehabilitation for mild to moderate Alzheimer’s disease and vascular dementia. Cochrane Database Syst Rev 2013;(6):CD003260.",1,1,Other Journal,Psychogenic,,Supplementary
"Baillargeon J, Raji MA, Urban RJ, et al: Opioid-induced hypogonadism in the United States. Mayo Clin Proc Innov Qual Outcomes 2019;3(3):276-284.",1,1,Other Major Journal,Musculoskeletal,,Supplementary
"Bair MJ, Krebs EE: Fibromyalgia. Ann Intern Med 2020;172(5):ITC33-ITC48.",1,1,Annals,Musculoskeletal,,Core
"Baird D, Hoffman A: Use of amphetamines for attention-deficit/hyperactivity disorder in adults. Am Fam Physician 2019;100(5):278-279.",1,1,AFP,Psychogenic,,Supplementary
"Baird DC, Batten SH, Sparks SK. - and -thalassemia: rapid evidence review. Am Fam Physician. 2022;105(3):272-280.",2,1,AFP,"Hematologic/Immune, Musculoskeletal",,Core
"Baird DC, Meyers GJ, Hu JS. Testicular cancer: diagnosis and treatment. Am Fam Physician. 2018;97(4):261-268.",1,1,AFP,Reproductive:Male,,Supplementary
"Bakaeen FG, Rosengart TK, Carabello BA: Aortic stenosis. Ann Intern Med 2017;166(1):ITC1-ITC16.",1,1,Annals,Cardiovascular,,Core
"Baker RD, Greer FR; Committee on Nutrition American Academy of Pediatrics: Diagnosis and prevention of iron deficiency and iron-deficiency anemia in infants and young children (0–3 years of age). Pediatrics 2010;126(5):1040-1050.",1,1,Guideline/Org,Gastrointestinal,,Core
"Bakris GL, Fonseca V, Katholi RE, et al: Metabolic effects of carvedilol vs metoprolol in patients with type 2 diabetes mellitus and hypertension: A randomized controlled trial. JAMA 2004;292(18):2227-2236.",1,1,Guideline/Org,Cardiovascular,,Core
Bal BS: An introduction to medical malpractice in the United States. Clin Orthop Relat Res 2009;467(2):339-347.,1,1,Other Journal,Population-Based Care,,Supplementary
"Baloh C, Reddy A, Henson M, et al: 30-Year review of pediatric- and adult-onset CVID: Clinical correlates and prognostic indicators. J Clin Immunol 2019;39(7):678-687.",1,1,Other Journal,Respiratory,,Supplementary
"Bancos I, Prete A: Approach to the patient with adrenal incidentaloma. J Clin Endocrinol Metab 2021;106(11):3331-3353.",1,1,Endocrine Journal,Endocrine,,Supplementary
"Banerjee ES, Schroeder R, Harrison TD. Metabolic surgery for adult obesity: common questions and answers. Am Fam Physician. 2022;105(6):593-601.",1,1,AFP,Hematologic/Immune,,Supplementary
"Barocas DA, Boorjian SA, Alvarez RD, et al: Microhematuria: AUA/SUFU guideline. J Urol 2020;204(4):778-786.",2,1,Guideline/Org,Nephrologic,,Core
"Barr W, Smith A: Acute diarrhea in adults. Am Fam Physician 2014;89(3):180-189.",1,1,AFP,Gastrointestinal,,Supplementary
"Barstow C, Rerucha C: Evaluation of short and tall stature in children. Am Fam Physician 2015;92(1):43-50.",1,1,AFP,Population-Based Care,,Supplementary
