QuestionID,ExamYear,RefIndex,Tier,Ref
Q2025-060,2025,3,Core,Final Recommendation Statement: Vitamin Supplementation to Prevent Cancer and CVD: Preventive Medication. US Preventive 
Q2025-060,2025,4,Core,"FitzGerald JD, Dalbeth N, Mikuls T, et al: 2020 American College of Rheumatology guideline for the management of gout. A"
Q2025-060,2025,5,Unmatched,"Carabello BA, Kodali S. Valvular heart disease. In: Goldman L, Cooney KA, eds. Goldman-Cecil Medicine. 27th ed. Vol. 1. "
Q2025-060,2025,6,Supplementary,"Grimard BH, Safford RE, Burns EL: Aortic stenosis: Diagnosis and treatment. Am Fam Physician 2016;93(5):371-378."
Q2025-063,2025,1,Unmatched,"Weaver-Agostoni J, Kosak Z, Bartlett S. Allergic rhinitis: rapid evidence review. Am Fam Physician. 2023;107(5):466-473."
Q2025-064,2025,1,Supplementary,"Williams T, Moore JB, Regehr J. Polycystic ovary syndrome: common questions and answers. Am Fam Physician. 2023;107(3):2"
Q2025-064,2025,2,Unmatched,"Nelson M, LaRouche V. Polycystic ovary syndrome: assessment and management guidelines. Am Fam Physician. 2024;110(5):547"
Q2025-065,2025,1,Unmatched,"Muncie HL, Sirmans SM, James E. Dizziness: approach to evaluation and management. Am Fam Physician. 2017;95(3):154-162."
Q2025-065,2025,2,Unmatched,"Rogers TS, Noel MA, Garcia B. Dizziness: evaluation and management. Am Fam Physician. 2023;107(5):514-523."
Q2025-066,2025,1,Unmatched,"Erlandson M, Wertz MC, Rosenfeld E. Common skin conditions during pregnancy. Am Fam Physician. 2023;107(2):152-158."
Q2025-067,2025,1,Unmatched,"Halken S, Muraro A, de Silva D, et al; European Academy of Allergy and Clinical Immunology Food Allergy and Anaphylaxis "
Q2025-067,2025,2,Unmatched,Am Fam Physician. 2023;108(2):159-165.
Q2025-068,2025,1,Unmatched,"Farahi N, McEachern M. Sexual assault of women. Am Fam Physician. 2021;103(3):168-176."
Q2025-069,2025,1,Unmatched,Am Fam Physician. 2016;94(3):236-240.
Q2025-069,2025,2,Unmatched,"Cary E, Simpson P. Premenstrual disorders and PMDD - a review. Best Pract Res Clin Endocrinol Metab. 2024;38(1):101858."
Q2025-070,2025,1,Supplementary,"Hartman-Adams H, Gerbo RM, George S. Tuberculosis: common questions and answers. Am Fam Physician. 2022;106(3):308-315."
Q2025-070,2025,2,Unmatched,Hasbun R. Progress and challenges in bacterial meningitis: a review. JAMA. 2022;328(21):2147-2154.
Q2025-070,2025,3,Unmatched,"Mount HR, Boyle SD. Aseptic and bacterial meningitis: evaluation, treatment, and prevention. Am Fam Physician. 2017;96(5"
Q2025-070,2025,4,Unmatched,"Ajdukiewicz KM, Cartwright KE, Scarborough M, et al. Glycerol adjuvant therapy in adults with bacterial meningitis in a "
Q2025-070,2025,5,Unmatched,"Brouwer MC, McIntyre P, Prasad K, van de Beek D. Corticosteroids for acute bacterial meningitis. Cochrane Database Syst "
Q2025-070,2025,6,Unmatched,"Kroch DA, Madanick RD. Medical treatment of gastroesophageal reflux disease. World J Surg. 2017;41(7):1678-1684."
Q2025-070,2025,7,Unmatched,"Clayton S, Emerson JF. Eosinophilic esophagitis: a mimic of gastroesophageal reflux disease. Am Fam Physician. 2018;97(1"
Q2025-070,2025,8,Unmatched,"Mohamed AA, Lu XL, Mounmin FA. Diagnosis and treatment of esophageal candidiasis: current updates. Can J Gastroenterol H"
Q2025-070,2025,9,Unmatched,Arnold MJ. Eosinophilic esophagitis: management guidelines from the AGA and JTF. Am Fam Physician. 2021;103(9):573-574.
Q2025-073,2025,1,Unmatched,"Farraye FA, Melmed GY, Lichtenstein GR, Kane SV. ACG clinical guideline: preventive care in inflammatory bowel disease. "
Q2025-073,2025,2,Unmatched,"Kobayashi M, Pilishvili T, Farrar JL, et al. Pneumococcal vaccine for adults aged ≥19 years: recommendations of the Advi"
Q2025-074,2025,1,Core,"Michels A, Michels N: Addison disease: Early detection and treatment principles. Am Fam Physician 2014;89(7):563-568."
Q2025-074,2025,2,Core,"Bornstein SR, Allolio B, Arlt W, et al: Diagnosis and treatment of primary adrenal insufficiency: An Endocrine Society c"
Q2025-074,2025,3,Core,"Runser LA, Gauer RL, Houser A: Syncope: Evaluation and differential diagnosis. Am Fam Physician 2017;95(5):303-312."
Q2025-074,2025,4,Unmatched,"Sandhu JS, Bixler BR, Dahm P, et al. Management of lower urinary tract symptoms attributed to benign prostatic hyperplas"
Q2025-074,2025,5,Unmatched,"Lerner LB, McVary KT, Barry MJ, et al. Management of lower urinary tract symptoms attributed to benign prostatic hyperpl"
Q2025-074,2025,6,Supplementary,"Westerfield KL, Koenig K, Oh R: Breastfeeding: Common questions and answers. Am Fam Physician 2018;98(6):368-373."
Q2025-078,2025,1,Must-Read,"Gaitonde DY, Moore FC, Morgan MK: Influenza: Diagnosis and treatment. Am Fam Physician 2019;100(12):751-758."
Q2025-079,2025,1,Unmatched,"Semenya AM, Bhatnagar P. Diagnosis and management of obsessive-compulsive disorder in the primary care setting. Am Fam P"
Q2025-079,2025,2,Unmatched,Falls are a common cause of serious injury and death in older adults in the United States. A 2018 study found that 27.5%
Q2025-079,2025,3,Core,Final Recommendation Statement: Falls Prevention in Community-Dwelling Older Adults: Interventions. US Preventive Servic
Q2025-079,2025,4,Unmatched,"Herness J, Sanders J, James J. Environmental interventions for preventing falls in older people living in the community."
Q2025-079,2025,5,Core,"Learn the signs. Act early: milestones. Centers for Disease Control and Prevention. Reviewed June 6, 2023."
Q2025-079,2025,6,Unmatched,"Malfertheiner P, Megraud F, Rokkas T, et al. Management of Helicobacter pylori infection: the Maastricht VI/Florence con"
Q2025-079,2025,7,Core,"Chey WD, Leontiadis GI, Howden CW, Moss SF. ACG clinical guideline: treatment of Helicobacter pylori infection. Am J Gas"
Q2025-079,2025,8,Supplementary,"Lanham JS, Nelson NK, Hendren B, Jordan TS: Outpatient burn care: Prevention and treatment. Am Fam Physician 2020;101(8)"
Q2025-079,2025,9,Core,"Stevens SM, Woller SC, Kreuziger LB, et al. Antithrombotic therapy for VTE disease: second update of the CHEST guideline"
Q2025-084,2025,1,Supplementary,"Chang K, Guarderas JC: Allergy testing: Common questions and answers. Am Fam Physician 2018;98(1):34-39."
Q2025-085,2025,1,Unmatched,"Lekoubou A, Nguyen C, Kwon M, Nyalundja AD, Agrawal A. Post-stroke everything. Curr Neurol Neurosci Rep. 2023;23(11):785"
Q2025-085,2025,2,Unmatched,"Masuccio FG, Grange E, Di Giovanni R, Rolla M, Solaro CM. Post-stroke depression in older adults: an overview. Drugs Agi"
Q2025-086,2025,1,Unmatched,"Dowell D, Ragan KR, Jones CM, Baldwin GT, Chou R. CDC clinical practice guideline for prescribing opioids for pain—Unite"
Q2025-086,2025,2,Unmatched,"Vavricka SR, Greuter T. Gastroparesis and dumping syndrome: current concepts and management. J Clin Med. 2019;8(8):1127."
Q2025-086,2025,3,Supplementary,"Banerjee ES, Schroeder R, Harrison TD. Metabolic surgery for adult obesity: common questions and answers. Am Fam Physici"
Q2025-086,2025,4,Unmatched,"Lawler HM. Idiopathic postprandial syndrome. In: McDermott MT, ed. Management of Patients with Pseudo-Endocrine Disorder"
Q2025-086,2025,5,Unmatched,"Paul CR, Frohna JG. Acute otitis media. Pediatrics in Review. 2025;46(3):139-147."
Q2025-086,2025,6,Unmatched,Shaughnessy AF. Imaging guidelines for children with mild traumatic brain injury. Am Fam Physician. 2024;110(2):202-203.
Q2025-086,2025,7,Unmatched,"Lumba-Brown A, Yeates KO, Sarmiento K, et al. Centers for Disease Control and Prevention guideline on the diagnosis and "
Q2025-086,2025,8,Unmatched,"Rigotti NA, Kruse GR, Livingstone-Banks J. Treatment of tobacco smoking: a review. JAMA. 2022;327(6):566-577."
Q2025-086,2025,9,Core,"Final Recommendation Statement: Perinatal Depression: Preventive Interventions. US Preventive Services Task Force, 2019."
Q2025-086,2025,10,Unmatched,"Levett JY, Filion KB, Reynier P, Prell C, Eisenberg MJ. Efficacy and safety of e-cigarette use for smoking cessation: a "
Q2025-086,2025,11,Must-Read,"Gentry S, Gentry B: Chronic obstructive pulmonary disease: Diagnosis and management. Am Fam Physician 2017;95(7):433-441"
Q2025-086,2025,12,Unmatched,"Umpierrez GE, Davis GM, ElSayed NA, et al. Hyperglycemic crises in adults with diabetes: a consensus report. Diabetes Ca"
Q2025-086,2025,13,Unmatched,Stoner GD. Hyperosmolar hyperglycemic state. Am Fam Physician. 2017;96(11):729-736.
Q2025-086,2025,14,Unmatched,"Shchendrygina A, Rakisheva A, Giverts I, Rustamova Y, Soloveva A. Effects of glucagon-like peptide-1 receptor agonists o"
Q2025-086,2025,15,Unmatched,"Halabi A, Sen J, Huynh Q, Marwick TH. Metformin treatment in heart failure with preserved ejection fraction: a systemati"
Q2025-086,2025,16,Core,"Heidenreich PA, Bozkurt B, Aguilar D, et al. 2022 AHA/ACC/HFSA guideline for the management of heart failure: a report o"
Q2025-086,2025,17,Core,"Final Recommendation Statement: Depression in Adults: Screening. US Preventive Services Task Force, 2016."
Q2025-086,2025,18,Core,"Final Recommendation Statement: Depression in Adults: Screening. US Preventive Services Task Force, 2016."
Q2025-086,2025,19,Core,American Diabetes Association Professional Practice Committee: 9. Pharmacologic approaches to glycemic treatment: Standa
Q2025-095,2025,1,Unmatched,"Harden RN, McCabe CS, Goebel A, et al. Complex regional pain syndrome: practical diagnostic and treatment guidelines, 5t"
Q2025-095,2025,2,Supplementary,"Lloyd ECO, Dempsey B, Romero L: Complex regional pain syndrome. Am Fam Physician 2021;104(1):49-55."
Q2025-096,2025,1,Unmatched,"Sexually transmitted infections treatment guidelines, 2021: pelvic inflammatory disease (PID). Centers for Disease Contr"
Q2025-096,2025,2,Unmatched,"Curry A, Williams T, Penny ML. Pelvic inflammatory disease: diagnosis, management, and prevention. Am Fam Physician. 201"
Q2025-097,2025,1,Unmatched,"Mendelson SJ, Prabhakaran S. Diagnosis and management of transient ischemic attack and acute ischemic stroke: a review. "
Q2025-098,2025,1,Core,"Smith A, Baumgartner K, Bositis C. Cirrhosis: diagnosis and management. Am Fam Physician. 2019;100(12):759-770."
Q2025-098,2025,2,Unmatched,Differentiated and simplified pre-exposure prophylaxis for HIV prevention: update to WHO implementation guidance. World 
Q2025-098,2025,3,Unmatched,"Biggins SW, Angeli P, Garcia-Tsao G, et al. Diagnosis, evaluation, and management of ascites, spontaneous bacterial peri"
Q2025-099,2025,1,Unmatched,"Iglesia CB, Smithling KR. Pelvic organ prolapse. Am Fam Physician. 2017;96(3):179-185."
Q2025-099,2025,2,Unmatched,"Taithongchai A, Johnson EE, Ismail SI, Barron-Millar E, Kernohan A, Thakar R. Oestrogen therapy for treating pelvic orga"
Q2025-099,2025,3,Unmatched,"Qiu J, Jiang D. Pessaries for managing pelvic organ prolapse in women. Am Fam Physician. 2021;103(11):660-661."
Q2025-100,2025,1,Unmatched,"Rosenberg H, Rosenberg E, Kubelik D. Acute limb ischemia. CMAJ. 2023;195(40):E1383."
Q2025-100,2025,2,Unmatched,"Olinic DM, Stanek A, Tătaru DA, Homorodean C, Olinic M. Acute limb ischemia: an update on diagnosis and management. J Cl"
Q2025-100,2025,3,Unmatched,"Firnhaber JM, Powell CS. Lower extremity peripheral artery disease: diagnosis and treatment. Am Fam Physician. 2019;99(6"
Q2025-101,2025,1,Unmatched,Am Fam Physician. 2024;110(6):592-600.
Q2025-102,2025,1,Unmatched,Schaefer P. Acute and chronic urticaria: evaluation and treatment. Am Fam Physician. 2017;95(11):717-724.
Q2025-102,2025,2,Unmatched,"Zuberbier T, Aberer W, Asero R, et al. The EAACI/GA²LEN/EDF/WAO guideline for the definition, classification, diagnosis "
Q2025-102,2025,3,Must-Read,"Chow AW, Benninger MS, Brook I, et al: IDSA clinical practice guideline for acute bacterial rhinosinusitis in children a"
Q2025-102,2025,4,Unmatched,"Lung cancer is the leading cause of cancer death in the United States, with approximately 90% of cases linked to smoking"
Q2025-102,2025,5,Must-Read,"Final Recommendation Statement: Lung Cancer: Screening. US Preventive Services Task Force, 2021."
Q2025-105,2025,1,Supplementary,"Sell J, Nasir M, Courchesne C: Urethritis: Rapid evidence review. Am Fam Physician 2021;103(9):553-558."
Q2025-105,2025,2,Unmatched,"Diseases characterized by urethritis and cervicitis. Sexually Transmitted Infections Treatment Guidelines, 2021. Centers"
Q2025-105,2025,3,Unmatched,"Mycoplasma genitalium. Sexually Transmitted Infections Treatment Guidelines, 2021. Centers for Disease Control and Preve"
Q2025-106,2025,1,Unmatched,"Edlow J. Diagnosing subarachnoid hemorrhage. J Emerg Med. 2021;61(5):623-624. Claassen J, Park S. Spontaneous subarachno"
Q2025-106,2025,2,Unmatched,Arnold MJ. Management of patients with aneurysmal subarachnoid hemorrhage: guidelines from the AHA and ASA. Am Fam Physi
Q2025-106,2025,3,Unmatched,"Hoh BL, Ko NU, Amin-Hanjani S, et al. 2023 guideline for the management of patients with aneurysmal subarachnoid hemorrh"
Q2025-106,2025,4,Unmatched,"Rubio-Tapia A, McCallum R, Camilleri M. AGA clinical practice update on diagnosis and management of cannabinoid hypereme"
Q2025-106,2025,5,Unmatched,"Perisetti A, Gajendran M, Dasari CS, et al. Cannabis hyperemesis syndrome: an update on the pathophysiology and manageme"
Q2025-106,2025,6,Unmatched,"Rubio-Tapia A, McCallum R, Camilleri M. AGA clinical practice update on diagnosis and management of cannabinoid hypereme"
Q2025-106,2025,7,Supplementary,"Winslow BT, Vandal C, Dang L. Fibromyalgia: diagnosis and management. Am Fam Physician. 2023;107(2):137-144."
Q2025-106,2025,8,Unmatched,Am Fam Physician. 2022;106(5):549-556.
Q2025-106,2025,9,Supplementary,"Baird D, Hoffman A: Use of amphetamines for attention-deficit/hyperactivity disorder in adults. Am Fam Physician 2019;10"
Q2025-111,2025,1,Unmatched,"Simon LM, Nguyen V, Ezinwa NM. Acute shoulder injuries in adults. Am Fam Physician. 2023;107(5):503-512."
Q2025-112,2025,1,Unmatched,"Mitchell KB, Johnson HM, Rodríguez JM, et al. Academy of Breastfeeding Medicine Clinical Protocol #36: the mastitis spec"
Q2025-112,2025,2,Unmatched,Lawrence KV. Supporting the paradigm shift: watchful waiting for lactational mastitis. Am Fam Physician. 2024;110(2):118
Q2025-112,2025,3,Unmatched,"Morcomb EF, Dargel CM, Anderson SA. Mastitis: rapid evidence review. Am Fam Physician. 2024;110(2):174-182."
Q2025-113,2025,1,Unmatched,Dictionary of genetics terms: autosomal recessive inheritance. National Cancer Institute at the National Institutes of H
Q2025-113,2025,2,Unmatched,"Collins MS, Mansilla-Rivera K. Diagnostic and therapeutic advances in cystic fibrosis: how family physicians can partner"
Q2025-113,2025,3,Unmatched,"Cystic fibrosis: causes. National Heart, Lung, and Blood Institute. Updated November 15, 2024."
Q2025-114,2025,1,Unmatched,"Latimer KM, Gunther A, Kopec M. Fatigue in adults: evaluation and management. Am Fam Physician. 2023;108(1):58-69."
Q2025-115,2025,1,Core,"Heidenreich PA, Bozkurt B, Aguilar D, et al. 2022 AHA/ACC/HFSA guideline for the management of heart failure: a report o"
Q2025-115,2025,2,Unmatched,JAMA. 2020;324(5):488–504.
Q2025-116,2025,1,Core,"Final Recommendation Statement: Depression in Adults: Screening. US Preventive Services Task Force, 2016."
Q2025-116,2025,2,Unmatched,"Hyman SL, Levy SE, Myers SM, et al; Council on Children with Disabilities, Section on Developmental and Behavioral Pedia"
Q2025-116,2025,3,Core,"Final Recommendation Statement: Vitamin D Deficiency: Screening. US Preventive Services Task Force, 2014."
Q2025-116,2025,4,Core,US Preventive Services Task Force. Final recommendation statement: prevention of dental caries in children younger than 
Q2025-116,2025,5,Core,"Final Recommendation Statement: Depression in Adults: Screening. US Preventive Services Task Force, 2016."
Q2025-117,2025,1,Unmatched,"Vaughan H, Rugo HS, Haemel A. Risk-based screening for cancer in patients with dermatomyositis: toward a more individual"
Q2025-117,2025,2,Unmatched,"Doherty TS, Carroll AE. Believing in overcoming cognitive biases. AMA J Ethics. 2020;22(9):E773-E778."
Q2025-117,2025,3,Unmatched,Sabin JA. Tackling implicit bias in health care. N Engl J Med. 2022;387(2):105-107.
Q2025-117,2025,4,Unmatched,"Catalogue of Bias Collaboration; Banerjee A, Nunan D. Availability bias. Catalogue of Bias. 2019."
Q2025-117,2025,5,Unmatched,"Oleka C, Dietrich JE. HMB in the adolescent: a review of the modern approach to diagnosis and management. Clin Obstet Gy"
Q2025-117,2025,6,Unmatched,"McConaghy JR, Decker A, Nair S. Peptic ulcer disease and H. pylori infection: common questions and answers. Am Fam Physi"
Q2025-117,2025,7,Supplementary,"Mounsey A, Barzin A, Rietz A: Functional dyspepsia: Evaluation and management. Am Fam Physician 2020;101(2):84-88."
Q2025-117,2025,8,Core,"Sell J, Ramirez S, Partin M. Parathyroid disorders. Am Fam Physician. 2022;105(3):289-298."
Q2025-117,2025,9,Unmatched,"Dalrymple SN, Row JH, Gazewood J. Bell palsy: rapid evidence review. Am Fam Physician. 2023;107(4):415-420."
Q2025-117,2025,10,Unmatched,"Gardner RC, Dams-O'Connor K, Morrissey MR, Manley GT. Geriatric traumatic brain injury: epidemiology, outcomes, knowledg"
Q2025-117,2025,11,Unmatched,"Pahor M. Falls in older adults: prevention, mortality, and costs. JAMA. 2019;321(21):2080-2081."
Q2025-117,2025,12,Unmatched,"Mori K, Abe T, Matsumoto J, Takahashi K, Takeuchi I. Indications for computed tomography in older adult patients with mi"
Q2025-124,2025,1,Unmatched,"Steiner MJ, DeWalt DA, Byerley JS. Is this child dehydrated?. JAMA. 2004;291(22):2746-2754."
Q2025-125,2025,1,Unmatched,FDA approves new nasal spray medication for treatment-resistant depression; available only at a certified doctor's offic
Q2025-125,2025,2,Core,"Miller L, Campo JV. Depression in adolescents. N Engl J Med. 2021;385(5):445-449."
Q2025-126,2025,1,Unmatched,"Smith SM, Fahey T, Smucny J, Becker LA. Antibiotics for acute bronchitis. Cochrane Database Syst Rev. 2017;6(6):CD000245"
Q2025-126,2025,2,Supplementary,"Killeen BM, Wolfson AB. Antibiotics for acute bronchitis. Am Fam Physician. 2020;102(9):Online."
Q2025-127,2025,1,Unmatched,"Silver S, Williams E, Plunkett ML. Common foot fractures. Am Fam Physician. 2024;109(2):119-129."
Q2025-127,2025,2,Supplementary,"Mulhem E, Khondoker F, Kandiah S. Constipation in children and adolescents: evaluation and treatment. Am Fam Physician. "
Q2025-127,2025,3,Core,"Grundy SM, Stone NJ, Bailey AL, et al: 2018 AHA/ACC/AACVPR/AAPA/ABC/ACPM/ADA/AGS/APhA/ ASPC/NLA/PCNA guideline on the ma"
Q2025-127,2025,4,Unmatched,Circulation. 2019;139(25):e1082-e1143.
Q2025-130,2025,1,Unmatched,"Lin CY, Lin CC, Chou YC, Chen PY, Wang CL. Heel pad stiffness in plantar heel pain by shear wave elastography. Ultrasoun"
Q2025-130,2025,2,Core,Tu P. Heel pain: diagnosis and management. Am Fam Physician. 2018;97(2):86-93.
Q2025-130,2025,3,Unmatched,"Rodriguez-Merchan EC, Moracia-Ochagavia I. Tarsal tunnel syndrome: current rationale, indications and results. EFORT Ope"
Q2025-130,2025,4,Unmatched,Nelson SC. Tarsal tunnel syndrome. Clin Podiatr Med Surg. 2021;38(2):131-141.
Q2025-131,2025,1,Unmatched,"Carter PM, Cunningham RM. Clinical approaches to the prevention of firearm-related injury. N Eng J Med. 2024;391(10):926"
Q2025-131,2025,2,Unmatched,"Meinke DK, Finan DS, Flamme GA, et al. Prevention of noise-induced hearing loss from recreational firearms. Semin Hear. "
Q2025-131,2025,3,Unmatched,"Olson DE, Weber J, Allen BF. Eye injuries. In: Madden CC, Putukian M, McCarty EC, et al, eds. Netter’s Sports Medicine. "
Q2025-132,2025,1,Supplementary,"McConaghy JR, Sharma M, Patel H: Acute chest pain in adults: Outpatient evaluation. Am Fam Physician 2020;102(12):721-72"
Q2025-133,2025,1,Unmatched,"NASS Evidence-Based Clinical Guidelines Committee; Matz P, Meagher RJ, Lamer T, et al. Evidence-Based Clinical Guideline"
Q2025-133,2025,2,Unmatched,"Walker MD, Shane E. Postmenopausal osteoporosis. N Engl J Med. 2023;389(21):1979-1991."
Q2025-134,2025,1,Core,American College of Obstetricians and Gynecologists’ Committee on Practice Bulletins—Gynecology. ACOG Practice Bulletin 
Q2025-135,2025,1,Unmatched,"Schillie S, Vellozzi C, Reingold A, et al. Prevention of hepatitis B virus infection in the United States: recommendatio"
Q2025-135,2025,2,Core,"Final Recommendation Statement: Vitamin D Deficiency: Screening. US Preventive Services Task Force, 2014."
Q2025-135,2025,3,Must-Read,"Final Recommendation Statement: Lung Cancer: Screening. US Preventive Services Task Force, 2021."
Q2025-135,2025,4,Must-Read,"Final Recommendation Statement: Lung Cancer: Screening. US Preventive Services Task Force, 2021."
Q2025-135,2025,5,Core,"Final Recommendation Statement: Depression in Adults: Screening. US Preventive Services Task Force, 2016."
Q2025-135,2025,6,Must-Read,"Final Recommendation Statement: Lung Cancer: Screening. US Preventive Services Task Force, 2021."
Q2025-135,2025,7,Unmatched,"Gelston CD, Deitz GA. Eye emergencies. Am Fam Physician. 2020;102(9):539-545. Raharja A, Whitefield L. Clinical approach"
Q2025-135,2025,8,Unmatched,Clin Med (Lond). 2022;22(2):95-99.
Q2025-135,2025,9,Unmatched,"Bagheri N, Mehta S. Acute vision loss. Prim Care. 2015;42(3):347-361."
Q2025-138,2025,1,Unmatched,"The Diagnosis and Treatment of Low Back Pain Work Group; Office of Quality and Patient Safety, Veterans Health Administr"
Q2025-138,2025,2,Unmatched,Am Fam Physician. 2023;107(4):435-437.
Q2025-139,2025,1,Unmatched,"Ortega R, Nozari A, Baker W, Surani S, Edwards M. Intranasal naloxone administration. N Engl J Med. 2021;384(12):e44."
Q2025-140,2025,1,Unmatched,"Fitzgibbons RJ Jr, Forse RA. Groin hernias in adults. N Engl J Med. 2015;372(8):756-763."
Q2025-140,2025,2,Unmatched,"Fitzgibbons RJ Jr, Giobbie-Hurder A, Gibbs JO, et al. Watchful waiting vs repair of inguinal hernia in minimally symptom"
Q2025-140,2025,3,Unmatched,"Shakil A, Aparicio K, Barta E, Munez K. Inguinal hernias: diagnosis and management. Am Fam Physician. 2020;102(8):487-49"
Q2025-140,2025,4,Unmatched,"Liu N, Prout TM, Xu Y, et al. Unnecessary use of radiology studies in the diagnosis of inguinal hernias: a retrospective"
Q2025-140,2025,5,Core,"Falk N, Cole A, Meredith TJ: Evaluation of suspected dementia. Am Fam Physician 2018;97(6):398-405."
Q2025-140,2025,6,Unmatched,"Nielsen M, Qaseem A; High Value Care Task Force of the American College of Physicians. Hematuria as a marker of occult u"
Q2025-140,2025,7,Supplementary,"Olsen KM, Manouchehr-Pour S, Donnelly EF, et al; Expert Panel on Thoracic Imaging; ACR Appropriateness Criteria: Hemopty"
Q2025-140,2025,8,Unmatched,"Devlies W, de Jong JJ, Hofmann F, et al. The diagnostic accuracy of cystoscopy for detecting bladder cancer in adults pr"
Q2025-140,2025,9,Unmatched,"Schwenker R, Dietrich CE, Hirpa S, et al. Motivational interviewing for substance use reduction. Cochrane Database Syst "
Q2025-140,2025,10,Unmatched,"Stewart EE, Fox CH. Encouraging patients to change unhealthy behaviors with motivational interviewing. Fam Pract Manag. "
Q2025-140,2025,11,Supplementary,Searight HR: Counseling patients in primary care: Evidence-based strategies. Am Fam Physician 2018;98(12):719-728.
Q2025-144,2025,1,Supplementary,"Loscalzo J, Fauci AS, Kasper DL, Hauser SL, Longo DL, Jameson JL, eds. Harrison’s Principles of Internal Medicine. 21st "
Q2025-145,2025,1,Unmatched,"Nabrdalik K, Hendel M, Irlik K, et al. Gastrointestinal adverse events of metformin treatment in patients with type 2 di"
Q2025-146,2025,1,Core,"Smith DK, Kuckel DP, Recidoro AM. Community-acquired pneumonia in children: rapid evidence review. Am Fam Physician. 202"
Q2025-147,2025,1,Supplementary,"Leggit JC, Meko CJ. Acute finger injuries: part I. Tendons and ligaments. Am Fam Physician. 2006;73(5):810-816."
Q2025-147,2025,2,Supplementary,"Borchers JR, Best TM: Common finger fractures and dislocations. Am Fam Physician 2012;85(8):805-810."
Q2025-148,2025,1,Unmatched,"Pyzocha N, Cuda Am. Common intestinal parasites. Am Fam Physician. 2023;108(5):487-493."
Q2025-148,2025,2,Unmatched,"Maguire MJ, Marson AG, Nevitt SJ. Antidepressants for people with epilepsy and depression. Cochrane Database Syst Rev. 2"
Q2025-148,2025,3,Must-Read,"Final Recommendation Statement: Lung Cancer: Screening. US Preventive Services Task Force, 2021."
Q2025-148,2025,4,Must-Read,"Final Recommendation Statement: Lung Cancer: Screening. US Preventive Services Task Force, 2021."
Q2025-148,2025,5,Core,Final Recommendation Statement: Hepatitis C Virus Infection in Adolescents and Adults: Screening. US Preventive Services
Q2025-148,2025,6,Core,Final Recommendation Statement: Elevated Blood Lead Levels in Children and Pregnant Women: Screening. US Preventive Serv
Q2025-148,2025,7,Unmatched,"Balahura AM, Moroi ȘI, Scafa-Udrişte A, et al. The management of hypertensive emergencies—is there a ""magical"" prescript"
Q2025-148,2025,8,Core,Peixoto AJ: Acute severe hypertension. N Engl J Med 2019;381(19):1843-1852.
Q2025-152,2025,1,Supplementary,"Semelka M, Wilson J, Floyd R. Diagnosis and treatment of obstructive sleep apnea in adults. Am Fam Physician. 2016;94(5)"
Q2025-152,2025,2,Unmatched,"Latimer KM, Gunther A, Kopec M. Fatigue in adults: evaluation and management. Am Fam Physician. 2023;108(1):58-69."
Q2025-153,2025,1,Core,Final Recommendation Statement: Hepatitis C Virus Infection in Adolescents and Adults: Screening. US Preventive Services
Q2025-153,2025,2,Must-Read,"Final Recommendation Statement: Lung Cancer: Screening. US Preventive Services Task Force, 2021."
Q2025-153,2025,3,Core,"Final Recommendation Statement: Adolescent Idiopathic Scoliosis: Screening. US Preventive Services Task Force, 2018."
Q2025-153,2025,4,Core,Final Recommendation Statement: Hepatitis C Virus Infection in Adolescents and Adults: Screening. US Preventive Services
Q2025-153,2025,5,Core,Final Recommendation Statement: Elevated Blood Lead Levels in Children and Pregnant Women: Screening. US Preventive Serv
Q2025-153,2025,6,Must-Read,Ramirez J: Adhesive capsulitis: Diagnosis and management. Am Fam Physician 2019;99(5):297-300.
