article_id,tier,classification,top_url,title,author1,year,source_type,query_used,exa_title
ART-0411,VC_pass,open_access,https://www.uspreventiveservicestaskforce.org/uspstf/recommendation/chronic-obstructive-pulmonary-disease-screening-2016,Chronic Obstructive Pulmonary Disease: Screening,Final,2016,Guideline/Org,Chronic Obstructive Pulmonary Disease: Screening Final 2016 PDF,Chronic Obstructive Pulmonary Disease: Screening - USPSTF
ART-0414,VC_pass,open_access,https://www.uspreventiveservicestaskforce.org/uspstf/recommendation/falls-prevention-in-older-adults-interventions-2018,Falls Prevention in Community-Dwelling Older Adults: Interventions,Final,2018,Guideline/Org,Falls Prevention in Community-Dwelling Older Adults: Interventions Final 2018 PDF,Falls Prevention in Community-Dwelling Older Adults: Interventions
ART-0417,VC_pass,open_access,https://www.uspreventiveservicestaskforce.org/Page/Document/final-evidence-review-nonpregnant-adolescents-and-adults/human-immunodeficiency-virus-hiv-infection-screening1,Human Immunodeficiency Virus (Hiv) Infection: Screening,Final,2019,Guideline/Org,Human Immunodeficiency Virus (Hiv) Infection: Screening Final 2019 PDF,Final Evidence Review: Nonpregnant Adolescents and Adults: Human Immunodeficiency Virus (HIV) Infection: Screening | United States Preventive Services Taskforce
ART-0418,VC_pass,open_access,https://www.uspreventiveservicestaskforce.org/uspstf/document/final-evidence-review/hypertension-in-adults-screening,Hypertension in Adults: Screening,Final,2021,Guideline/Org,Hypertension in Adults: Screening Final 2021 PDF,Final Evidence Review: Hypertension in Adults: Screening | United States Preventive Services Taskforce
ART-0419,VC_pass,open_access,https://www.uspreventiveservicestaskforce.org/uspstf/document/final-evidence-review/low-dose-aspirin-use-for-the-prevention-of-morbidity-and-mortality-from-preeclampsia-preventive-medication,Low-Dose Aspirin Use for the Prevention of Morbidity and Mortality from Preeclampsia: Preventive Medication,Final,2021,Guideline/Org,Low-Dose Aspirin Use for the Prevention of Morbidity and Mortality from Preeclampsia: Preventive Medication Final 2021 PDF,Final Evidence Review: Aspirin Use to Prevent Preeclampsia and Related Morbidity and Mortality: Preventive Medication | United States Preventive Services Taskforce
ART-0421,VC_pass,open_access,https://www.uspreventiveservicestaskforce.org/uspstf/recommendation/osteoporosis-screening-june-2018,Osteoporosis to Prevent Fractures: Screening,Final,2018,Guideline/Org,Osteoporosis to Prevent Fractures: Screening Final 2018 PDF,Osteoporosis to Prevent Fractures: Screening - USPSTF
ART-0422,VC_pass,open_access,https://www.uspreventiveservicestaskforce.org/Page/Document/RecommendationStatementFinal/perinatal-depression-preventive-interventions,Perinatal Depression: Preventive Interventions,Final,2019,Guideline/Org,Perinatal Depression: Preventive Interventions Final 2019 PDF,Perinatal Depression: Preventive Interventions - USPSTF
ART-0423,VC_pass,open_access,https://www.uspreventiveservicestaskforce.org/uspstf/document/RecommendationStatementFinal/screening-for-prediabetes-and-type-2-diabetes,Prediabetes And Type 2 Diabetes: Screening,Final,2021,Guideline/Org,Prediabetes And Type 2 Diabetes: Screening Final 2021 PDF,Final Recommendation Statement: Prediabetes and Type 2 Diabetes: Screening | United States Preventive Services Taskforce
ART-0424,VC_pass,open_access,https://www.uspreventiveservicestaskforce.org/uspstf/recommendation/prevention-of-dental-caries-in-children-younger-than-age-5-years-screening-and-interventions1,Prevention Of Dental Caries In Children Younger Than 5 Years: Screening And Interventions,Final,2021,Guideline/Org,Prevention Of Dental Caries In Children Younger Than 5 Years: Screening And Interventions Final 2021 PDF,Prevention of Dental Caries in Children Younger Than 5 ...
ART-0426,VC_pass,open_access,https://www.uspreventiveservicestaskforce.org/uspstf/recommendation/carotid-artery-stenosis-screening,Screening for Asymptomatic Carotid Artery Stenosis,Final,2021,Guideline/Org,Screening for Asymptomatic Carotid Artery Stenosis Final 2021 PDF,Asymptomatic Carotid Artery Stenosis: Screening - USPSTF
ART-0428,VC_pass,open_access,https://www.uspreventiveservicestaskforce.org/uspstf/recommendation/vitamin-d-deficiency-screening,Vitamin D Deficiency In Adults: Screening,Final,2021,Guideline/Org,Vitamin D Deficiency In Adults: Screening Final 2021 PDF,Vitamin D Deficiency in Adults: Screening - USPSTF
ART-0429,VC_pass,open_access,https://www.uspreventiveservicestaskforce.org/uspstf/document/evidence-summary18/vitamin-d-deficiency-screening-november-2014,Vitamin D Deficiency: Screening,Final,2014,Guideline/Org,Vitamin D Deficiency: Screening Final 2014 PDF,Archived: Evidence Summary: Vitamin D Deficiency: Screening | United States Preventive Services Taskforce
ART-0430,VC_pass,open_access,https://uspreventiveservicestaskforce.org/Home/GetFile/1/1057/vitasuppfinalrs/pdf,Vitamin Supplementation to Prevent Cancer and CVD: Preventive Medication,Final,2014,Guideline/Org,Vitamin Supplementation to Prevent Cancer and CVD: Preventive Medication Final 2014 PDF,"[PDF] Vitamin, Mineral, and Multivitamin Supplements for the ... - USPSTF"
ART-0444,VC_pass,open_access,https://onlinelibrary.wiley.com/doi/full/10.1111/apt.15001,"Systematic review with meta-analysis: The efficacy of prebiotics, probiotics, synbiotics and antibiotics in irritable bowel syndrome",Ford,2018,Other Journal,"Systematic review with meta-analysis: The efficacy of prebiotics, probiotics, synbiotics and antibiotics in irritable bowel syndrome Ford 2018 PDF","Systematic review with meta‐analysis: the efficacy of prebiotics, probiotics, synbiotics and antibiotics in irritable bowel syndrome"
ART-0465,VC_pass,open_access,https://www.aafp.org/pubs/afp/issues/2022/1100/smoking-cessation-interventions.html,513-522,Gaddey,2022,AFP,513-522 Gaddey 2022,Smoking Cessation Interventions | AAFP
ART-0492,VC_pass,open_access,https://www.bmj.com/content/309/6948/184,Medical ethics: Four principles plus attention to scope,Gillon,1994,BMJ,Medical ethics: Four principles plus attention to scope Gillon 1994,Medical ethics: four principles plus attention to scope - The BMJ
ART-0566,VC_pass,open_access,https://www.aafp.org/pubs/afp/issues/2022/0900/tuberculosis.html,common questions and answers,Hartman-Adams,2022,AFP,common questions and answers Hartman-Adams 2022,Tuberculosis: Common Questions and Answers | AAFP
ART-0636,VC_pass,open_access,https://www.cochranelibrary.com/cdsr/doi/10.1002/14651858.CD004879.pub5/full,Vaccines for preventing influenza in healthy children,Jefferson,2018,Other Journal,Vaccines for preventing influenza in healthy children Jefferson 2018 PDF,"Vaccines for preventing influenza in healthy children - Jefferson, T - 2018 | Cochrane Library"
ART-0679,VC_pass,open_access,https://www.aafp.org/pubs/afp/issues/2021/0601/p698.html,Chronic kidney disease in diabetes: Guidelines from KDIGO,Khunti,2021,AFP,Chronic kidney disease in diabetes: Guidelines from KDIGO Khunti 2021,Chronic Kidney Disease in Diabetes: Guidelines from KDIGO - AAFP
ART-0728,VC_pass,open_access,https://www.aafp.org/pubs/afp/issues/2018/0401/od1.html,Duration of bisphosphonate therapy,Lam,2018,AFP,Duration of bisphosphonate therapy Lam 2018,Duration of Bisphosphonate Therapy - AAFP
ART-0827,VC_pass,open_access,https://www.aafp.org/pubs/afp/issues/2021/1000/p386.html,Diabetes-related foot infections: Diagnosis and treatment,Matheson,2021,AFP,Diabetes-related foot infections: Diagnosis and treatment Matheson 2021,Diabetes-Related Foot Infections: Diagnosis and Treatment - AAFP
ART-0946,VC_pass,open_access,https://www.aafp.org/pubs/afp/issues/2022/0700/acute-pancreatitis.html,rapid evidence review,Oppenlander,2022,AFP,rapid evidence review Oppenlander 2022,Acute Pancreatitis: Rapid Evidence Review
ART-0999,VC_pass,open_access,https://www.frontiersin.org/articles/10.3389/fneur.2022.914814/pdf,management and therapies,Powers,2022,Textbook,management and therapies Powers 2022,"An interactive web-based programme on relapse management for people with multiple sclerosis (POWER@MS2) - development, feasibility, and pilot testing of a complex intervention"
ART-1035,VC_pass,open_access,https://www.aafp.org/pubs/afp/issues/2015/1201/p1023.html,AHA/ACC/ASH release guideline on the treatment of hypertension and CAD,Randel,2015,AFP,AHA/ACC/ASH release guideline on the treatment of hypertension and CAD Randel 2015,AHA/ACC/ASH Release Guideline on the Treatment of ...
ART-1050,VC_pass,open_access,https://www.frontiersin.org/journals/endocrinology/articles/10.3389/fendo.2020.558819/full,Preterm birth,Reproductive,2020,Guideline/Org,Preterm birth Reproductive 2020 PDF,"Frontiers | Preterm Birth in Assisted Reproductive Technology: An Analysis of More Than 20,000 Singleton Newborns"
ART-1113,VC_pass,open_access,https://www.aafp.org/pubs/afp/issues/2022/0300/p302.html,302-306,Schefft,2022,AFP,302-306 Schefft 2022,Appropriate Use of Electrocardiography in Preparticipation Physical ...
ART-1253,VC_pass,open_access,https://www.uspreventiveservicestaskforce.org/uspstf/document/RecommendationStatementFinal/cardiovascular-disease-screening-using-nontraditional-risk-assessment,Risk assessment for cardiovascular disease with nontraditional risk factors: US Preventive Services Task Force recommendation statement,US,2018,JAMA,Risk assessment for cardiovascular disease with nontraditional risk factors: US Preventive Services Task Force recommendation statement US 2018,Final Recommendation Statement: Cardiovascular Disease: Risk Assessment With Nontraditional Risk Factors | United States Preventive Services Taskforce
ART-1258,VC_pass,open_access,https://www.uspreventiveservicestaskforce.org/uspstf/document/ClinicalSummaryFinal/human-immunodeficiency-virus-hiv-infection-screening,human immunodeficiency virus (HIV) infection: screening,US Preventive Services Task Force. Final recommendation statement,2019,Guideline/Org,human immunodeficiency virus (HIV) infection: screening US 2019 PDF,Human Immunodeficiency Virus (HIV) Infection: Screening - USPSTF
ART-1260,VC_pass,open_access,https://www.uspreventiveservicestaskforce.org/uspstf/recommendation/prevention-of-dental-caries-in-children-younger-than-age-5-years-screening-and-interventions1,prevention of dental caries in children younger than 5 years: screening and interventions,US Preventive Services Task Force. Final recommendation statement,2021,Guideline/Org,prevention of dental caries in children younger than 5 years: screening and interventions US 2021 PDF,Prevention of Dental Caries in Children Younger Than 5 Years ...
ART-1265,VC_pass,open_access,https://www.uspreventiveservicestaskforce.org/home/getfilebytoken/umGzAGWUVDPcnmbdYnHf_a,"vitamin, mineral, and multivitamin supplementation to prevent cardiovascular disease and cancer: preventive medication",US Preventive Services Task Force. Final recommendation statement,2022,Guideline/Org,"vitamin, mineral, and multivitamin supplementation to prevent cardiovascular disease and cancer: preventive medication US 2022 PDF","[PDF] Vitamin, Mineral, and Multivitamin Supplementation to Prevent ..."
ART-1267,VC_pass,open_access,https://www.uspreventiveservicestaskforce.org/uspstf/document/RecommendationStatementFinal/perinatal-depression-preventive-interventions,Interventions to prevent perinatal depression: US Preventive Services Task Force Recommendation Statement,US Preventive Services Task Force,2019,JAMA,Interventions to prevent perinatal depression: US Preventive Services Task Force Recommendation Statement US 2019,Final Recommendation Statement: Perinatal Depression: Preventive Interventions | United States Preventive Services Taskforce
ART-1271,VC_pass,open_access,https://www.aafp.org/pubs/afp/issues/2006/1101/p1547.html,Polymyalgia rheumatica and giant cell arteritis,Unwin,2006,AFP,Polymyalgia rheumatica and giant cell arteritis Unwin 2006,Polymyalgia Rheumatica and Giant Cell Arteritis - AAFP
ART-1297,VC_pass,open_access,https://stacks.cdc.gov/view/cdc/85912,Q&As for health professionals,Viral,2020,Guideline/Org,Q&As for health professionals Viral 2020 PDF,"Healthcare Professionals: Frequently Asked Questions and Answers: Updated March 17, 2020"
ART-1311,VC_pass,open_access,https://bmcpediatr.biomedcentral.com/articles/10.1186/s12887-022-03199-0,The toddler’s fracture,Wang,2022,Other Journal,The toddler’s fracture Wang 2022 PDF,"Epidemiology and management of 10,486 pediatric fractures in Shenzhen: experience and lessons to be learnt"
ART-1552,VC_pass,open_access,https://www.aafp.org/pubs/afp/issues/2017/0801/p196.html,Developmental dysplasia of the hip in infants: A clinical report from the AAP on evaluation and referral,Hauk,2017,AFP,Developmental dysplasia of the hip in infants: A clinical report from the AAP on evaluation and referral Hauk 2017,Developmental Dysplasia of the Hip in Infants: A Clinical Report ...
ART-1773,VC_pass,open_access,https://www.aafp.org/pubs/afp/issues/2016/0701/p53.html,Procalcitonin-guided antibiotic therapy for acute respiratory infections,Morris,2016,AFP,Procalcitonin-guided antibiotic therapy for acute respiratory infections Morris 2016,Procalcitonin-Guided Antibiotic Therapy for Acute Respiratory ...
ART-0017,VC_fail,open_access,https://www.aafp.org/pubs/afp/issues/2022/0600/p602.html,evaluation and treatment,Achar,2022,AFP,evaluation and treatment Achar 2022,Soft Tissue Masses: Evaluation and Treatment
ART-0038,VC_fail,open_access,https://www.cochranelibrary.com/cdsr/doi/10.1002/14651858.CD013496.pub2/abstract?cookiesEnabled,Intermittent fasting for the prevention of cardiovascular disease,Allaf,2021,Other Journal,Intermittent fasting for the prevention of cardiovascular disease Allaf 2021 PDF,"Intermittent fasting for the prevention of cardiovascular disease - Allaf, M - 2021 | Cochrane Library"
ART-0070,VC_fail,open_access,https://www.aafp.org/pubs/afp/collections/choosing-wisely/183.html,"Avoid using prescription appetite stimulants or high-calorie supplements for treating of anorexia or cachexia in older adults; instead, optimize social supports, discontinue medications that may interfere with eating, provide appealing food and feeding assistance, and clarify patient goals and expectations",American,2015,Other Journal,"Avoid using prescription appetite stimulants or high-calorie supplements for treating of anorexia or cachexia in older adults; instead, optimize social supports, discontinue medications that may interfere with eating, provide appealing food and feeding assistance, and clarify patient goals and expectations American 2015 PDF",Avoid using prescription appetite stimulants or high-calorie ... - AAFP
ART-0080,VC_fail,open_access,https://aafp.org/pubs/afp/collections/choosing-wisely/274.html,Offer PSA screening for detecting prostate cancer only after engaging in shared decision making,American,2015,Other Journal,Offer PSA screening for detecting prostate cancer only after engaging in shared decision making American 2015 PDF,Offer PSA screening for detecting prostate cancer only after engaging in shared decision making.
ART-0086,VC_fail,open_access,https://academic.oup.com/cid/article/72/10/e663/5906597,Adult outpatient treatment recommendations,Antibiotic,2017,Guideline/Org,Adult outpatient treatment recommendations Antibiotic 2017 PDF,"Duration of Outpatient Antibiotic Therapy for Common Outpatient Infections, 2017"
ART-0091,VC_fail,open_access,https://www.aafp.org/pubs/afp/issues/2018/1201/p688.html,Lung cancer screening recommendations from the ACCP,Armstrong,2018,AFP,Lung cancer screening recommendations from the ACCP Armstrong 2018,Lung Cancer Screening Recommendations from the ACCP - AAFP
ART-0104,VC_fail,open_access,https://ebm.bmj.com/content/9/5/151,The accuracy of the Ottawa knee rule to rule out knee fractures: A systematic review,Bachmann,2004,Annals,The accuracy of the Ottawa knee rule to rule out knee fractures: A systematic review Bachmann 2004,Review: the Ottawa knee rule accurately rules out knee fractures and can substantially reduce the need for x rays in patients with acute knee injuries
ART-0105,VC_fail,open_access,https://www.bmj.com/content/326/7386/417.full,Accuracy of Ottawa ankle rules to exclude fractures of the ankle and mid-foot: Systematic review,Bachmann,2003,BMJ,Accuracy of Ottawa ankle rules to exclude fractures of the ankle and mid-foot: Systematic review Bachmann 2003,Accuracy of Ottawa ankle rules to exclude fractures of the ankle and mid-foot: systematic review
ART-0137,VC_fail,open_access,https://www.aafp.org/pubs/afp/issues/2018/0901/p298.html,Common foot problems: Over-the-counter treatments and home care,Becker,2018,AFP,Common foot problems: Over-the-counter treatments and home care Becker 2018,Common Foot Problems: Over-the-Counter Treatments and Home ...
ART-0147,VC_fail,open_access,https://academic.oup.com/bjd/article-abstract/174/1/195/6616462?redirectedFrom=fulltext,evidence from the national Italian registry,Bettoli,2016,Other Journal,evidence from the national Italian registry Bettoli 2016 PDF,"Overweight, diabetes and disease duration influence clinical severity in hidradenitis suppurativa–acne inversa: evidence from the national Italian registry"
ART-0152,VC_fail,open_access,https://www.aafp.org/pubs/afp/issues/2016/0201/p183.html,Diagnosis and management of common foot fractures,Bica,2016,AFP,Diagnosis and management of common foot fractures Bica 2016,Diagnosis and Management of Common Foot Fractures - AAFP
ART-0159,VC_fail,open_access,https://www.aafp.org/pubs/afp/issues/2019/0901/p298.html,diagnosis and treatment,Bonkemeyer,2019,AFP,diagnosis and treatment Bonkemeyer 2019,Venous Ulcers: Diagnosis and Treatment - AAFP
ART-0167,VC_fail,open_access,https://www.frontiersin.org/articles/10.3389/fonc.2024.1369065/full,prevention and treatment,Bragg,2024,AFP,prevention and treatment Bragg 2024,Frontiers | Feasibility and constraints of Bragg peak FLASH proton therapy treatment planning
ART-0171,VC_fail,open_access,https://aafp.org/pubs/afp/issues/2017/1115/p640.html,Cardiomyopathy: An overview,Brieler,2017,AFP,Cardiomyopathy: An overview Brieler 2017,Cardiomyopathy: An Overview
ART-0173,VC_fail,open_access,https://www.aafp.org/pubs/afp/issues/2023/0800/food-allergies.html,"diagnosis, treatment, and prevention",Bright,2023,AFP,"diagnosis, treatment, and prevention Bright 2023","Food Allergies: Diagnosis, Treatment, and Prevention - AAFP"
ART-0180,VC_fail,open_access,https://www.aafp.org/pubs/afp/issues/2022/1200/galactorrhea.html,rapid evidence review,Bruehlman,2022,AFP,rapid evidence review Bruehlman 2022,Galactorrhea: Rapid Evidence Review - AAFP
ART-0188,VC_fail,open_access,https://www.mdpi.com/1660-4601/16/14/2584,a systematic review and meta-analysis,Bui,2018,Other Journal,a systematic review and meta-analysis Bui 2018 PDF,Epidermal Growth Factor is Effective in the Treatment of Diabetic Foot Ulcers: Meta-Analysis and Systematic Review
ART-0191,VC_fail,open_access,https://www.aafp.org/pubs/afp/issues/2008/0215.html,Chronic shoulder pain: Part I,Burbank,2008,AFP,Chronic shoulder pain: Part I Burbank 2008,"February 15, 2008 - AAFP"
ART-0192,VC_fail,open_access,https://www.aafp.org/pubs/afp/issues/2008/0215/p493.html,Chronic shoulder pain: Part II,Burbank,2008,AFP,Chronic shoulder pain: Part II Burbank 2008,Chronic Shoulder Pain: Part II. Treatment - AAFP
ART-0194,VC_fail,open_access,https://www.aafp.org/pubs/afp/issues/2018/0301/p331.html,Care of the colorectal cancer survivor,Burgers,2018,AFP,Care of the colorectal cancer survivor Burgers 2018,Care of the Colorectal Cancer Survivor | AAFP
ART-0196,VC_fail,open_access,https://www.aafp.org/pubs/afp/collections/taxonomy.osteomyelitis.html,Osteomyelitis: Diagnosis and treatment,Bury,2021,AFP,Osteomyelitis: Diagnosis and treatment Bury 2021,Osteomyelitis - Taxonomy | AAFP
ART-0197,VC_fail,open_access,https://www.aafp.org/pubs/afp/issues/2022/1100/photo-quiz-scrotal-mass.html,571-572,Butani,2022,AFP,571-572 Butani 2022,Enlarging Scrotal Mass - AAFP
ART-0205,VC_fail,open_access,https://www.cochranelibrary.com/cdsr/doi/10.1002/14651858.CD008509.pub3/abstract?cookiesEnabled,-Blockers as medical expulsive therapy for ureteral stones,Campschroer,2018,Other Journal,-Blockers as medical expulsive therapy for ureteral stones Campschroer 2018 PDF,"Alpha‐blockers as medical expulsive therapy for ureteral stones - Campschroer, T - 2018 | Cochrane Library"
ART-0206,VC_fail,open_access,https://www.aafp.org/pubs/afp/issues/2013/0315/p419.html,"Managing difficult encounters: Understanding physician, patient, and situational factors",Cannarella,2013,AFP,"Managing difficult encounters: Understanding physician, patient, and situational factors Cannarella 2013","Understanding Physician, Patient, and Situational Factors - AAFP"
ART-0207,VC_fail,open_access,https://www.uspreventiveservicestaskforce.org/home/getfilebytoken/EUEa4aSUoa9zkDwM6CTEzd,Screening for Elevated Blood Lead Levels in Children: A Systematic Review for the U,Cantor,2019,Other Journal,Screening for Elevated Blood Lead Levels in Children: A Systematic Review for the U Cantor 2019 PDF,[PDF] Screening for Elevated Blood Lead Levels in Children - USPSTF
ART-0211,VC_fail,open_access,https://www.aafp.org/pubs/afp/issues/2015/0715/p106.html,Differential diagnosis of the swollen red eyelid,Carlisle,2015,AFP,Differential diagnosis of the swollen red eyelid Carlisle 2015,Differential Diagnosis of the Swollen Red Eyelid - AAFP
ART-0217,VC_fail,open_access,https://aafp.org/pubs/afp/issues/2006/0315/p1014.html,Childhood and adolescent sports-related overuse injuries,Cassas,2006,AFP,Childhood and adolescent sports-related overuse injuries Cassas 2006,Childhood and Adolescent Sports-Related Overuse Injuries
ART-0220,VC_fail,open_access,https://www.aafp.org/pubs/afp/issues/2019/0801/p143.html,"Vaccines for preventing influenza in healthy children, healthy adults, and older adults",Cayley,2019,AFP,"Vaccines for preventing influenza in healthy children, healthy adults, and older adults Cayley 2019",Vaccines for Preventing Influenza in Healthy Children ... - AAFP
ART-0227,VC_fail,open_access,https://www.aafp.org/pubs/afp/issues/2018/0701/p34.html,Allergy testing: Common questions and answers,Chang,2018,AFP,Allergy testing: Common questions and answers Chang 2018,Allergy Testing: Common Questions and Answers - AAFP
ART-0247,VC_fail,open_access,https://www.cdc.gov/rocky-mountain-spotted-fever/hcp/clinical-care/index.html,Clinical care of Rocky Mountain spotted fever. Centers for Disease Control and P,Clinical,2025,Guideline/Org,Clinical care of Rocky Mountain spotted fever. Centers for Disease Control and P Clinical 2025 PDF,Clinical Care of Rocky Mountain Spotted Fever - CDC
ART-0266,VC_fail,open_access,https://www.aafp.org/pubs/afp/issues/2018/0201/p180.html,Tremor: Sorting through the differential diagnosis,Crawford,2018,AFP,Tremor: Sorting through the differential diagnosis Crawford 2018,Tremor: Sorting Through the Differential Diagnosis - AAFP
ART-0275,VC_fail,open_access,https://www.cdc.gov/mmwr/volumes/65/rr/rr6504a1.htm,"US selected practice recommendations for contraceptive use, 2016",Curtis,2016,Other Journal,"US selected practice recommendations for contraceptive use, 2016 Curtis 2016 PDF","U.S. Selected Practice Recommendations for Contraceptive Use, 2016"
ART-0285,VC_fail,open_access,https://www.aafp.org/pubs/afp/issues/2018/0401/p465.html,Digital clues,Danoff,2018,AFP,Digital clues Danoff 2018,Digital Clues - AAFP
ART-0289,VC_fail,open_access,https://www.bmj.com/content/360/bmj.k186,k186,Davies,2018,BMJ,k186 Davies 2018,Degenerative cervical myelopathy - The BMJ
ART-0291,VC_fail,open_access,https://www.aafp.org/pubs/afp/issues/2017/0115/p100.html,Uterine fibroids: Diagnosis and treatment,De,2017,AFP,Uterine fibroids: Diagnosis and treatment De 2017,Uterine Fibroids: Diagnosis and Treatment - AAFP
ART-0298,VC_fail,open_access,https://www.aafp.org/pubs/afp/issues/2022/0800/generalized-anxiety-disorder-panic-disorder.html,Generalized anxiety disorder,DeMartini,2019,Annals,Generalized anxiety disorder DeMartini 2019,Generalized Anxiety Disorder and Panic Disorder in Adults | AAFP
ART-0309,VC_fail,open_access,https://www.aafp.org/pubs/afp/issues/2012/0401.html,Gynecomastia,Dickson,2012,AFP,Gynecomastia Dickson 2012,"April 1, 2012 - AAFP"
ART-0333,VC_fail,open_access,https://www.bmj.com/content/355/bmj.i5124,i5124,Drake,2016,BMJ,i5124 Drake 2016,Haematospermia - The BMJ
ART-0334,VC_fail,open_access,http://medbox.iiab.me/modules/en-cdc/www.cdc.gov/healthywater/drinking/private/wells/diseases.html,Overview of water-related diseases and contaminants in private wells,Drinking,2021,Guideline/Org,Overview of water-related diseases and contaminants in private wells Drinking 2021 PDF,"Overview of Water-related Diseases and Contaminants in Private Wells


 | Wells | Private Water Systems | Drinking Water | Healthy Water | CDC"
ART-0342,VC_fail,open_access,https://www.aafp.org/pubs/afp/issues/2021/0800/p195.html,Diagnosis and initial management of acute colonic diverticulitis,DuBose,2021,AFP,Diagnosis and initial management of acute colonic diverticulitis DuBose 2021,Diagnosis and Initial Management of Acute Colonic Diverticulitis
ART-0353,VC_fail,open_access,https://www.aafp.org/pubs/afp/issues/2017/0615/p805.html,Bariatric surgery improves quality of life and results in more weight loss than intensive medical therapy,Ebell,2017,AFP,Bariatric surgery improves quality of life and results in more weight loss than intensive medical therapy Ebell 2017,Bariatric Surgery Improves Quality of Life and Results in More ...
