article_id,tier,classification,top_url,title,author1,year,source_type,query_used,exa_title
ART-0790,VC_pass,landing_page,https://www.textileebook.com/2022/08/harrisons-principles-internal-medicine-21e.html,"Harrison’s Principles of Internal Medicine, ed 21",Loscalzo,2022,Other Journal,"Harrison’s Principles of Internal Medicine, ed 21 Loscalzo 2022 PDF","Harrison’s Principles Of Internal Medicine, 21th Edition PDF by Joseph Loscalzo"
ART-0847,VC_pass,landing_page,https://pubmed.ncbi.nlm.nih.gov/34164803/,Altered dietary salt intake for people with chronic kidney disease,McMahon,2015,Other Journal,Altered dietary salt intake for people with chronic kidney disease McMahon 2015 PDF,Altered dietary salt intake for people with chronic kidney disease
ART-0848,VC_pass,landing_page,https://www.nejm.org/doi/full/10.1056/NEJMoa1911303,Dapagliflozin in patients with heart failure and reduced ejection fraction,McMurray,2019,NEJM,Dapagliflozin in patients with heart failure and reduced ejection fraction McMurray 2019,Dapagliflozin in Patients with Heart Failure and Reduced Ejection ...
ART-0860,VC_pass,landing_page,https://el.z-library.sk/book/28262291/84ca4b/williams-textbook-of-endocrinology-14th-edition.html,"Williams Textbook of Endocrinology, ed 14",Melmed,2020,Other Journal,"Williams Textbook of Endocrinology, ed 14 Melmed 2020 PDF",Williams Textbook of Endocrinology 14th Edition | Shlomo Melmed et al | download on Z-Library
ART-0861,VC_pass,landing_page,https://pubmed.ncbi.nlm.nih.gov/35166488/,156-161,Mendez-Miller,2022,AFP,156-161 Mendez-Miller 2022,Borderline Personality Disorder - PubMed
ART-0874,VC_pass,landing_page,https://pubmed.ncbi.nlm.nih.gov/34320289/,445-449,Miller,2021,NEJM,445-449 Miller 2021,Depression in Adolescents - PubMed
ART-0888,VC_pass,landing_page,https://www.elsevier.es/en-revista-open-respiratory-archives-11-articulo-challenges-in-treatment-obesity-hypoventilation-S2659663625000815,e6-e24,Mokhlesi,2019,Guideline/Org,e6-e24 Mokhlesi 2019 PDF,Challenges in the Treatment of Obesity Hypoventilation Syndrome ...
ART-0895,VC_pass,landing_page,https://pubmed.ncbi.nlm.nih.gov/26564381/,Immediate delivery compared with expectant management after preterm pre-labour rupture of the membranes close to term (PPROMT trial): A randomised controlled trial,Morris,2016,Lancet,Immediate delivery compared with expectant management after preterm pre-labour rupture of the membranes close to term (PPROMT trial): A randomised controlled trial Morris 2016,a randomised controlled trial - PubMed
ART-0905,VC_pass,landing_page,https://www.nice.org.uk/guidance/ng88/resources/heavy-menstrual-bleeding-assessment-and-management-pdf-1837701412549,Heavy menstrual bleeding: Assessment and management,NICE guideline [NG88],2020,Other Journal,Heavy menstrual bleeding: Assessment and management NICE 2020 PDF,[PDF] Heavy menstrual bleeding: assessment and management | NICE
ART-0912,VC_pass,landing_page,https://www.nice.org.uk/guidance/ng38,fractures (non-complex): assessment and management,National,2016,Other Journal,fractures (non-complex): assessment and management National 2016 PDF,Fractures (non-complex): assessment and management | Guidance
ART-0941,VC_pass,landing_page,https://journals.lww.com/clinicalobgyn/toc/2020/09000,a review of the modern approach to diagnosis and management,Oleka,2020,Other Journal,a review of the modern approach to diagnosis and management Oleka 2020 PDF,September 2020 - Issue 3 : Clinical Obstetrics and Gynecology
ART-0943,VC_pass,landing_page,https://www.semanticscholar.org/paper/ACR-Appropriateness-Criteria%C2%AE-Hemoptysis.-Olsen-Manouchehr-Pour/c3d801fa95ab9c7e2527a329593a0034e63e3bb2,Hemoptysis,Olsen,2020,Other Journal,Hemoptysis Olsen 2020 PDF,ACR Appropriateness Criteria® Hemoptysis. | Semantic Scholar
ART-0951,VC_pass,landing_page,https://polst.org/for-professionals/,"POLST for Health Care Professionals. National POLST website, 2022.",POLST,2022,Other Journal,"POLST for Health Care Professionals. National POLST website, 2022. POLST 2022 PDF",POLST For Professionals | National POLST Collaborative
ART-0963,VC_pass,landing_page,https://openorthopaedicsjournal.com/VOLUME/11/PAGE/1405/FULLTEXT/,Comparison of early mobilization protocols in radial head fractures,Paschos,2013,Other Journal,Comparison of early mobilization protocols in radial head fractures Paschos 2013 PDF,Radial Head Fractures - The Open Orthopaedics Journal
ART-0982,VC_pass,landing_page,https://link.springer.com/chapter/10.1007/5584_2019_410?error=cookies_not_supported&code=f7a9d2d1-8b68-4476-bf8e-e55b984b6a8a,Clinicians,Pertussis,2019,Guideline/Org,Clinicians Pertussis 2019 PDF,Clinical Findings and Management of Pertussis
ART-1000,VC_pass,landing_page,https://diabetesjournals.org/care/article/45/Supplement_1/S17/138925/2-Classification-and-Diagnosis-of-Diabetes,"diagnosis, classification, and pathophysiology",Powers,2022,Textbook,"diagnosis, classification, and pathophysiology Powers 2022",2. Classification and Diagnosis of Diabetes: Standards of Medical ...
ART-1003,VC_pass,landing_page,http://20.austlii.edu.au/cgi-bin/viewdoc/au/cases/vic/VCC/2020/1727.html,252-260,Powers,2020,NEJM,252-260 Powers 2020,DPP v Powers (a pseudonym) [2020] VCC 1727 (28 October 2020)
ART-1012,VC_pass,landing_page,https://asmbs.org/patients/bariatric-surgery-procedures/,Public Education Committee. Bariatric surgery procedures. American Society for M,Public,2021,Other Journal,Public Education Committee. Bariatric surgery procedures. American Society for M Public 2021 PDF,Bariatric Surgery Procedures - American Society for Metabolic and ...
ART-1021,VC_pass,landing_page,https://pubmed.ncbi.nlm.nih.gov/21810710/,"Diagnosis and management of stable chronic obstructive pulmonary disease: A clinical practice guideline update from the American College of Physicians, American College of Chest Physicians, American Thoracic Society, and European Respiratory Society",Qaseem,2011,Annals,"Diagnosis and management of stable chronic obstructive pulmonary disease: A clinical practice guideline update from the American College of Physicians, American College of Chest Physicians, American Thoracic Society, and European Respiratory Society Qaseem 2011",Diagnosis and management of stable chronic obstructive pulmonary ...
ART-1026,VC_pass,landing_page,https://www.scirp.org/reference/referencespapers?referenceid=3870896,Diagnosis of idiopathic pulmonary fibrosis,Raghu,2018,Guideline/Org,Diagnosis of idiopathic pulmonary fibrosis Raghu 2018 PDF,"Raghu, G., Remy-Jardin, M., Myers, J.L., Richeldi, L., Ryerson, C.J., Lederer, D.J., et al. (2018) Diagnosis of Idiopathic Pulmonary Fibrosis. an Official ATS/ERS/JRS/ALAT Clinical Practice Guideline. American Journal of Respiratory and Critical Care Medicine, 198, e44-e68.  - References - Scientific Research Publishing"
ART-1049,VC_pass,landing_page,https://www.proquest.com/openview/187ac3a315250c3cc146d735aa6193d0/1.pdf?cbl=2040978&pq-origsite=gscholar,Number needed to screen: Development of a statistic for disease screening,Rembold,1998,BMJ,Number needed to screen: Development of a statistic for disease screening Rembold 1998,Number needed to screen: development of a statistic for disease screening
ART-1059,VC_pass,landing_page,https://www.cochrane.org/evidence/CD004783_antibiotics-treat-adults-acute-laryngitis,CD004783,Reveiz,2015,Other Journal,CD004783 Reveiz 2015 PDF,Antibiotics to treat adults with acute laryngitis - Cochrane
ART-1064,VC_pass,landing_page,https://pubmed.ncbi.nlm.nih.gov/18381550/,841-848,Rice,2008,Pediatrics,841-848 Rice 2008,Medical conditions affecting sports participation - PubMed
ART-1067,VC_pass,landing_page,https://pubmed.ncbi.nlm.nih.gov/35133411/,a review,Rigotti,2022,JAMA,a review Rigotti 2022,Treatment of Tobacco Smoking: A Review - PubMed
ART-1070,VC_pass,landing_page,https://pubmed.ncbi.nlm.nih.gov/30277729/,High blood pressure in children and adolescents,Riley,2018,AFP,High blood pressure in children and adolescents Riley 2018,High Blood Pressure in Children and Adolescents - PubMed
ART-1071,VC_pass,landing_page,https://www.ccjm.org/content/86/7/465,Giant cell arteritis: An updated review of an old disease,Rinden,2019,Other Journal,Giant cell arteritis: An updated review of an old disease Rinden 2019 PDF,Giant cell arteritis: An updated review of an old disease
ART-1105,VC_pass,landing_page,https://utsouthwestern.elsevierpure.com/en/publications/management-of-lower-urinary-tract-symptoms-attributed-to-benign-p-3/,AUA guideline amendment 2023,Sandhu,2023,Other Journal,AUA guideline amendment 2023 Sandhu 2023 PDF,Management of Lower Urinary Tract Symptoms Attributed to Benign ...
ART-1112,VC_pass,landing_page,https://pubmed.ncbi.nlm.nih.gov/34706173/,Management of abdominal aortic aneurysms,Schanzer,2021,NEJM,Management of abdominal aortic aneurysms Schanzer 2021,Management of Abdominal Aortic Aneurysms - PubMed
ART-1116,VC_pass,landing_page,https://www.researchgate.net/publication/378438820_Abnormal_Uterine_Bleeding_Associated_With_Hormonal_Contraception,161-166,Schrager,2024,AFP,161-166 Schrager 2024,Abnormal Uterine Bleeding Associated With Hormonal Contraception
ART-1117,VC_pass,landing_page,https://pubmed.ncbi.nlm.nih.gov/36521464/,diagnosis and management,Schroeder,2022,AFP,diagnosis and management Schroeder 2022,Hip Fractures: Diagnosis and Management
ART-1133,VC_pass,landing_page,https://pubmed.ncbi.nlm.nih.gov/35289573/,289-298,Sell,2022,AFP,289-298 Sell 2022,Parathyroid Disorders - PubMed
ART-1143,VC_pass,landing_page,https://www.scirp.org/reference/referencespapers?referenceid=3195360,Clinical practice,Shapiro,2014,NEJM,Clinical practice Shapiro 2014,"Shapiro, F. (2014). The Role of Eye Movement Desensitization and ..."
ART-1144,VC_pass,landing_page,https://www.clinicalkey.jp/#!/content/journal/1-s2.0-S0278591919300973?scrollTo=%23hl0000469,279-297,Shapiro,2020,Textbook,279-297 Shapiro 2020,Evaluation and Treatment of Flexor Tendon and Pulley Injuries in ...
ART-1148,VC_pass,landing_page,https://www.cfrjournal.com/editions/cfr-volume-10-2024?language_content_entity=en,e10,Shchendrygina,2024,Other Journal,e10 Shchendrygina 2024 PDF,"Volume 10, 2024 | CFR Journal - Cardiac Failure Review"
ART-1168,VC_pass,landing_page,https://www.semanticscholar.org/paper/Type-1-Diabetes:-Management-Strategies.-Smith-Harris/c090ac6c17085a1951acff216674167c4e0b49fb,Type 1 diabetes: Management strategies,Smith,2018,AFP,Type 1 diabetes: Management strategies Smith 2018,Type 1 Diabetes: Management Strategies.
ART-1169,VC_pass,landing_page,https://pubmed.ncbi.nlm.nih.gov/34913645/,rapid evidence review,Smith,2021,AFP,rapid evidence review Smith 2021,Community-Acquired Pneumonia in Children: Rapid Evidence Review
ART-1179,VC_pass,landing_page,https://pubmed.ncbi.nlm.nih.gov/31140587/,Adverse effects of pharmacologic treatments of major depression in older adults,Sobieraj,2019,Other Journal,Adverse effects of pharmacologic treatments of major depression in older adults Sobieraj 2019 PDF,Adverse Effects of Pharmacologic Treatments of Major Depression ...
ART-1226,VC_pass,landing_page,https://emcrit.org/ibcc/buprenorphine/,ITC1-ITC16,Taylor,2022,Annals,ITC1-ITC16 Taylor 2022,Opioid use disorder & opioid withdrawal - EMCrit Project
ART-1233,VC_pass,landing_page,https://pubmed.ncbi.nlm.nih.gov/36238954/,The World Professional Association for Transgender Health. Standards of care for,The,2022,Textbook,The World Professional Association for Transgender Health. Standards of care for The 2022,Standards of Care for the Health of Transgender and Gender ...
ART-1238,VC_pass,landing_page,https://shop.elsevier.com/books/sabiston-textbook-of-surgery/townsend/978-0-323-29987-9,"Sabiston Textbook of Surgery: The
Biological Basis of Modern Surgical Practice, ed 20",Townsend,2017,Other Journal,"Sabiston Textbook of Surgery: The
Biological Basis of Modern Surgical Practice, ed 20 Townsend 2017 PDF",Sabiston Textbook of Surgery - 20th Edition - Elsevier Shop
ART-1239,VC_pass,landing_page,https://shop.elsevier.com/books/sabiston-textbook-of-surgery/townsend/978-0-323-29987-9,"Sabiston Textbook of Surgery: The Biological Basis of Modern
Surgical Practice, ed 20",Townsend,2017,Other Journal,"Sabiston Textbook of Surgery: The Biological Basis of Modern
Surgical Practice, ed 20 Townsend 2017 PDF",Sabiston Textbook of Surgery - 20th Edition - Elsevier Shop
ART-1240,VC_pass,landing_page,https://shop.elsevier.com/books/sabiston-textbook-of-surgery/townsend/978-0-323-29987-9,"Sabiston Textbook of Surgery: The Biological Basis of Modern Surgical Practice, ed 20",Townsend,2017,Other Journal,"Sabiston Textbook of Surgery: The Biological Basis of Modern Surgical Practice, ed 20 Townsend 2017 PDF",Sabiston Textbook of Surgery - 20th Edition - Elsevier Shop
ART-1284,VC_pass,landing_page,https://pubmed.ncbi.nlm.nih.gov/25146390/,Diagnosis and management of thyrotoxicosis,Vaidya,2014,BMJ,Diagnosis and management of thyrotoxicosis Vaidya 2014,Diagnosis and management of thyrotoxicosis - PubMed
ART-1306,VC_pass,landing_page,https://dokumen.pub/rosens-emergency-medicine-concepts-and-clinical-practice-9nbsped-9780323354790-9996111695-9996111636-2016055133-9789996111693-9789996111631.html,"Rosen’s Emergency Medicine: Concepts and Clinical Practice, ed 9",Walls,2018,Other Journal,"Rosen’s Emergency Medicine: Concepts and Clinical Practice, ed 9 Walls 2018 PDF",Rosen's Emergency Medicine: Concepts and Clinical Practice [9 ed ...
ART-1310,VC_pass,landing_page,https://www.ccjm.org/content/83/11/810/tab-figures-data,"Serotonin syndrome: Preventing, recognizing, and treating it",Wang,2016,Other Journal,"Serotonin syndrome: Preventing, recognizing, and treating it Wang 2016 PDF","Serotonin syndrome: Preventing, recognizing, and treating it"
ART-1316,VC_pass,landing_page,https://ora.ox.ac.uk/objects/uuid:aa774085-15a1-47b5-aa0f-a1409b8e56d7,CD015171,Webster,2023,Other Journal,CD015171 Webster 2023 PDF,Systemic pharmacological interventions for Ménière's disease - ORA ...
ART-1317,VC_pass,landing_page,https://ora.ox.ac.uk/objects/uuid:adf2da95-3d62-45df-bafb-04aa6c69bdb4,CD015244,Webster,2023,Other Journal,CD015244 Webster 2023 PDF,Lifestyle and dietary interventions for Ménière's disease - ORA ...
ART-1329,VC_pass,landing_page,https://pubmed.ncbi.nlm.nih.gov/35166491/,177-186,Wheeler,2022,AFP,177-186 Wheeler 2022,Cervical Ripening and Induction of Labor - PubMed
ART-1333,VC_pass,landing_page,https://www.nejm.org/doi/full/10.1056/NEJMra2005230,Spectrum of fibrotic lung diseases,Wijsenbeek,2020,NEJM,Spectrum of fibrotic lung diseases Wijsenbeek 2020,Spectrum of Fibrotic Lung Diseases
ART-1343,VC_pass,landing_page,https://link.springer.com/article/10.1007/s00394-019-01896-8,the Expect study I,Willemse,2020,Other Journal,the Expect study I Willemse 2020 PDF,Calcium intake from diet and supplement use during early pregnancy
ART-1363,VC_pass,landing_page,https://www.academia.edu/13614024/The%5FClinical%5FAssessment%5FTreatment%5Fand%5FPrevention%5Fof%5FLyme%5FDisease%5FHuman%5FGranulocytic%5FAnaplasmosis%5Fand%5FBabesiosis%5FClinical%5FPractice%5FGuidelines%5Fby%5Fthe%5FInfectious%5FDiseases%5FSociety%5Fof%5FAmerica,"The clinical assessment, treatment, and prevention of Lyme disease, human granulocytic anaplasmosis, and babesiosis: Clinical practice guidelines by the Infectious Diseases Society of America",Wormser,2006,Guideline/Org,"The clinical assessment, treatment, and prevention of Lyme disease, human granulocytic anaplasmosis, and babesiosis: Clinical practice guidelines by the Infectious Diseases Society of America Wormser 2006 PDF","(PDF) The Clinical Assessment, Treatment, and Prevention of Lyme Disease, Human Granulocytic Anaplasmosis, and Babesiosis: Clinical Practice Guidelines by the Infectious Diseases Society of America"
ART-1365,VC_pass,landing_page,https://pubmed.ncbi.nlm.nih.gov/30932448/,435-443,Wouk,2019,AFP,435-443 Wouk 2019,Abnormal Uterine Bleeding in Premenopausal Women - PubMed
ART-1368,VC_pass,landing_page,https://cks.nice.org.uk/topics/menieres-disease/background-information/prognosis/,Menière’s disease,Wright,2015,BMJ,Menière’s disease Wright 2015,Prognosis | Background information | Ménière's disease - CKS - NICE
ART-1369,VC_pass,landing_page,https://www.ahajournals.org/doi/10.1161/CIR.0000000000000665,2019 AHA/ACC/HRS focused update of the 2014 AHA/ACC/HRS guideline for the management of patients with atrial fibrillation: A report of the American College of Cardiology/American Heart Association Task Force on Clinical Practice Guidelines and the Heart Rhythm Society,Writing,2019,Guideline/Org,2019 AHA/ACC/HRS focused update of the 2014 AHA/ACC/HRS guideline for the management of patients with atrial fibrillation: A report of the American College of Cardiology/American Heart Association Task Force on Clinical Practice Guidelines and the Heart Rhythm Society Writing 2019 PDF,2019 AHA/ACC/HRS Focused Update of the 2014 AHA/ACC/HRS ...
ART-1371,VC_pass,landing_page,https://www.caribbeanmedicaljournal.org/2024/12/31/an-atypical-presentation-of-todds-paralysis/,e920751,Xu,2020,Other Journal,e920751 Xu 2020 PDF,An atypical presentation of Todd's Paralysis
ART-1372,VC_pass,landing_page,https://www.ahajournals.org/doi/10.1161/cir.0000000000000509,2017 ACC/AHA/HFSA focused update of the 2013 ACCF/AHA guideline for the management of heart failure: A report of the American College of Cardiology/American Heart Association Task Force on Clinical Practice Guidelines and the Heart Failure Society of America,Yancy,2017,Circulation,2017 ACC/AHA/HFSA focused update of the 2013 ACCF/AHA guideline for the management of heart failure: A report of the American College of Cardiology/American Heart Association Task Force on Clinical Practice Guidelines and the Heart Failure Society of America Yancy 2017,2017 ACC/AHA/HFSA Focused Update of the 2013 ACCF/AHA ...
ART-1376,VC_pass,landing_page,https://go.gale.com/ps/i.do?id=GALE%7CA529222785&v=2.1&it=r&linkaccess=abs&issn=00943509&p=AONE&sw=w&userGroupName=anon%7Ecfacac49&aty=open-web-entry,COPD in primary care: Key considerations for optimized management: Treatment options for stable chronic obstructive pulmonary disease: Current recommendations and unmet needs,Yawn,2018,Textbook,COPD in primary care: Key considerations for optimized management: Treatment options for stable chronic obstructive pulmonary disease: Current recommendations and unmet needs Yawn 2018,Treatment Options for Stable Chronic Obstructive Pulmonary Disease: Current Recommendations and Unmet Needs - Document
ART-1391,VC_pass,landing_page,https://clinicalmonster.com/em-class-of-2022-new/,Online,Zwillenberg,2022,AFP,Online Zwillenberg 2022,EM Class of 2022-new - Kings County Hospital | SUNY Downstate
ART-1393,VC_pass,landing_page,https://www.acpjournals.org/doi/10.7326/M19-3193,L-Thyroxine therapy for older adults with subclinical hypothyroidism and hypothyroid symptoms: Secondary analysis of a randomized trial,de,2020,Annals,L-Thyroxine therapy for older adults with subclinical hypothyroidism and hypothyroid symptoms: Secondary analysis of a randomized trial de 2020,L-Thyroxine Therapy for Older Adults With Subclinical ...
ART-1394,VC_pass,landing_page,https://www.sciencedirect.com/science/article/pii/S1477893920303215,a systematic review and meta-analysis,de,2020,Other Journal,a systematic review and meta-analysis de 2020 PDF,"Comorbidities, clinical signs and symptoms, laboratory findings, imaging features, treatment strategies, and outcomes in adult and pediatric patients with COVID-19: A systematic review and meta-analysis"
ART-1712,VC_pass,landing_page,https://pubmed.ncbi.nlm.nih.gov/24695507/,A stepwise approach to the interpretation of pulmonary function tests,Johnson,2014,AFP,A stepwise approach to the interpretation of pulmonary function tests Johnson 2014,A stepwise approach to the interpretation of pulmonary ...
ART-1797,VC_pass,landing_page,https://www.acpjournals.org/doi/10.7326/M14-2326?articleid=2294149,Recommendation statement,Screening,2015,AFP,Recommendation statement Screening 2015,Screening for Cancer: Advice for High-Value Care From the American College of Physicians
ART-1876,VC_pass,landing_page,https://jamanetwork.com/journals/jama/fullarticle/2708121,"Intimate Partner Violence, Elder Abuse, and Abuse of Vulnerable Adults: Screening",Final,2018,Guideline/Org,"Intimate Partner Violence, Elder Abuse, and Abuse of Vulnerable Adults: Screening Final 2018 PDF","Screening for Intimate Partner Violence, Elder Abuse, and Abuse of ..."
ART-1894,VC_pass,landing_page,https://www.acog.org/clinical/clinical-guidance/practice-bulletin/articles/2015/09/emergency-contraception,Emergency contraception,Practice,2015,Guideline/Org,Emergency contraception Practice 2015 PDF,Emergency Contraception | ACOG
ART-1930,VC_pass,landing_page,https://bestpractice.bmj.com/info/us/evidence/ebm-toolbox/a-glossary-of-ebm-terms/,EBM glossary,American,2018,Other Journal,EBM glossary American 2018 PDF,A glossary of EBM terms | BMJ Best Practice
ART-1936,VC_pass,landing_page,https://pubmed.ncbi.nlm.nih.gov/24444505/,Evaluation of the patient with hip pain,Wilson,2014,AFP,Evaluation of the patient with hip pain Wilson 2014,Evaluation of the patient with hip pain - PubMed
ART-0001,VC_fail,landing_page,https://jamanetwork.com/journals/jama/article-abstract/302565,A venous hum is an innocent heart murmur that is caused by vein vibration. It is,A,,Other Journal,A venous hum is an innocent heart murmur that is caused by vein vibration. It is A PDF,VENOUS HUM IN CARDIAC AUSCULTATION
ART-0004,VC_fail,landing_page,https://journals.lww.com/greenjournal/fulltext/2013/06000/committee_opinion_no__565__hormone_therapy_and.43.aspx,Hormone therapy and heart disease,ACOG Committee Opinion No. 565,2013,Guideline/Org,Hormone therapy and heart disease ACOG 2013 PDF,Committee Opinion No. 565: Hormone Therapy and Heart Disease
ART-0006,VC_fail,landing_page,https://www.acr.org/Clinical-Resources/Clinical-Tools-and-Reference/Appropriateness-Criteria,"ACR appropriateness criteria. American College of Radiology, 2022.",ACR,2022,Other Journal,"ACR appropriateness criteria. American College of Radiology, 2022. ACR 2022 PDF",ACR Appropriateness Criteria - American College of Radiology
ART-0007,VC_fail,landing_page,https://www.jamda.com/article/S1525-8610(25)00263-4/fulltext,AMDA – The Society for Post-Acute and Long-Term Care Medicine. Don’t order routi,AMDA,2020,Chest,AMDA – The Society for Post-Acute and Long-Term Care Medicine. Don’t order routi AMDA 2020,A Consensus Statement From the Post-Acute and Long-Term Care ...
ART-0008,VC_fail,landing_page,https://discovery.researcher.life/article/the-polst-paradox-opportunities-and-challenges-in-honoring-patient-end-of-life-wishes-in-the-emergency-department/cbe58a2aa68a3767b180be6f9dc515ec,opportunities and challenges in honoring patient end-of-life wishes in the emergency department,Abbott,2019,Textbook,opportunities and challenges in honoring patient end-of-life wishes in the emergency department Abbott 2019,The POLST Paradox: Opportunities and Challenges in Honoring Patient End-of-Life Wishes in the Emergency Department - R Discovery
ART-0009,VC_fail,landing_page,http://www.iupac.org/news/news-detail/article/discovery-and-assignment-of-elements-with-atomic-numbers-113-115-117-and-118.html,1138,Abdel,2015,Other Journal,1138 Abdel 2015 PDF,"Discovery and Assignment of Elements with Atomic Numbers 113, 115, 117 and 118 - IUPAC | International Union of Pure and Applied Chemistry"
ART-0010,VC_fail,landing_page,https://discovery.researcher.life/article/omega-3-fatty-acids-for-the-primary-and-secondary-prevention-of-cardiovascular-disease/ff02c706e84d326580ad2d61ea29d36a,Omega-3 fatty acids for the primary and secondary prevention of cardiovascular disease,Abdelhamid,2020,Other Journal,Omega-3 fatty acids for the primary and secondary prevention of cardiovascular disease Abdelhamid 2020 PDF,Omega-3 fatty acids for the primary and secondary prevention of cardiovascular disease. - R Discovery
ART-0011,VC_fail,landing_page,https://journals.lww.com/md-journal/fulltext/2017/01270/nonadherence_to_antihypertensive_drugs__a.9.aspx,a systematic review and meta-analysis,Abegaz,2017,Other Journal,a systematic review and meta-analysis Abegaz 2017 PDF,Nonadherence to antihypertensive drugs - Medicine
ART-0019,VC_fail,landing_page,https://pubmed.ncbi.nlm.nih.gov/32603067/,Back pain in children and adolescents,Achar,2020,AFP,Back pain in children and adolescents Achar 2020,Back Pain in Children and Adolescents - PubMed
ART-0022,VC_fail,landing_page,https://dig.pharmacy.uic.edu/faqs/2025-2/february-2025-faqs/is-there-literature-specifically-guidelines-available-on-how-to-medically-manage-adverse-reactions-associated-with-intravenous-iron/,"Loscalzo J, Fauci A, Kasper D, et al, eds",Adamson,2022,Textbook,"Loscalzo J, Fauci A, Kasper D, et al, eds Adamson 2022","Is there literature, specifically guidelines, available on how to ..."
ART-0024,VC_fail,landing_page,https://www.aafp.org/about/policies/all/social-determinants-health-family-medicine-position-paper.html,Advancing health equity by addressing the social determinants of health in famil,Advancing,2019,Other Journal,Advancing health equity by addressing the social determinants of health in famil Advancing 2019 PDF,Advancing Health Equity by Addressing the Social Determinants of ...
ART-0026,VC_fail,landing_page,https://www.news-medical.net/health/Mythbusting-Misconceptions-surrounding-Parkinsone28099s-Disease.aspx,"Common myths and misconceptions that sidetrack Parkinson disease treatment, to the detriment of patients",Ahlskog,2020,Other Journal,"Common myths and misconceptions that sidetrack Parkinson disease treatment, to the detriment of patients Ahlskog 2020 PDF",Mythbusting: Misconceptions surrounding Parkinson's Disease
